date,press,region,title,sub_title,description,content,article_url,image_url
2026-02-25,한국경제,national,"한전 '역대급 실적' 터졌는데…""배당 늘리자 vs 안돼"" 줄다리기",,지난해 역대급 실적을 거둔 것으로 추정되는 한국전력공사 배당 문제를 두고 재정경제부와 기후에너지환경부가 줄다리기를 하고 있다.재경부는 재정 확충을 위해 배당을 확대해야 한다고 주장하지만 기후부는 200조원을 웃도는 한전의 부채를 고려해 배당을 최소화해야 한다고 팽팽히 ...,"지난해 역대급 실적을 거둔 것으로 추정되는 한국전력공사 배당 문제를 두고 재정경제부와 기후에너지환경부가 줄다리기를 하고 있다.재경부는 재정 확충을 위해 배당을 확대해야 한다고 주장하지만 기후부는 200조원을 웃도는 한전의 부채를 고려해 배당을 최소화해야 한다고 팽팽히 맞섰다. 24일 관계부처에 따르면 재경부 주관으로 지난 23일 공기업 배당을 결정하는 정부 배당협의체가 열렸다. 정부 배당협의체는 통상 한전을 비롯해 한국가스공사, 기업은행 등 정부 출자 기업의 배당 여부와 규모를 정하는 기구다. 각 공기업이 매년 초 당기순이익 등 잠정 결산 자료를 제출하면, 2월에 협의체 논의를 거쳐 배당안을 확정한다. 이 자리에서 재경부와 기후부는 한전 배당을 놓고 평행선을 달렸다. 이날 회의에서는 한전 배당을 둘러싼 이견이 뚜렷하게 드러났다. 한 정부 관계자는 “한전을 포함한 공기업 배당 증액 여부를 두고 재경부와 소관 부처 간 시각차가 작지 않았다”고 전했다. 논란의 배경 뒤에는 한전의 ‘역대급 실적’이 자리잡고 있다. 금융정보업체 에프앤가이드에 따르면 한전은 지난해 영업이익 14조9238억원, 순이익 9조380억원을 기록한 것으로 추산됐다. 영업이익은 창사 이후 최대치다. 배당의 기준이 되는 순이익은 전년 대비 149.53% 급증했다. 국제 유가를 비롯한 연료 가격이 안정세를 보인 데다 전력도매가격(SMP·전력구입가격)이 하락한 영향이 컸다. SMP는 한전이 발전 공기업이나 민간 발전사로부터 전력을 사들이는 가격으로, 이 수치가 떨어지면 한전의 수익성이 개선된다. 최근 수년간 이어진 전기요금 인상도 실적 개선에 힘을 보탰다는 분석이 나온다. 한전은 지난해에도 1367억원의 배당을 시행했다. 2024년 실적을 토대로 한 배당으로, 4년 만에 재개한 것이다. 하지만 배당성향은 3.8%로 낮은 수준에 그쳤다. 재경부는 지난해 순이익이 대폭 늘어난 만큼 배당을 확대해야 한다는 입장이다. 올해 역시 호실적이 이어질 가능성이 높다는 점도 배당 증액의 근거로 들고 있다. 반면 한전 소관부처인 기후부는 한전의 살림살이를 고려할 때 “지금은 배당을 늘릴 때가 아니다”고 항변하고 있다. 한전은 2021년 5조8464억원, 2022년 32조6562억원, 2023년 4조5416억원의 영업손실을 냈다. 2024년 흑자 전환에 성공했지만, 그 사이 부채는 눈덩이처럼 불어났다. 지난해 9월 말 기준 부채비율은 430%, 총부채는 205조원을 넘었다. 지난해 9월 말까지 이자비용만 3조2794억원에 달했고, 연간 기준으로는 4조원에 이를 것으로 추산된다. 하루 이자비용만 약 110억원에 달하는 셈이다. 이자비용이 상당한 만큼 유가가 다시 오를 경우 순이익이 재차 적자로 돌아설 가능성도 배제할 수 없다. 여기에 재생에너지 확대와 첨단 산업 전력 수요 증가에 대응하기 위한 대규모 송·배전망 투자도 예고됐다. 정부의 ‘제11차 전력수급기본계획(2024~2038년)’에 따르면 향후 송·배전 설비에 약 113조원이 투입될 전망이다. 김익환",https://www.hankyung.com/article/202602253223i,https://img.hankyung.com/photo/202602/01.42074204.3.jpg
2026-02-24,한국경제,national,중위소득 넘는 '잘사는 노인' 기초연금서 단계적으로 배제,,기초연금 차등 지급…'잘사는 노인' 덜 준다정부가 65세 이상 고령자 가운데 소득 하위 70%에 일괄 지급해온 기초연금을 소득에 따라 차등 지급하는 개편안을 검토하고 있다. 기준 중위소득을 지급 기준 상한선으로 정해 중장기적으로 수급자를 줄이...,"기초연금 차등 지급…'잘사는 노인' 덜 준다 정부가 65세 이상 고령자 가운데 소득 하위 70%에 일괄 지급해온 기초연금을 소득에 따라 차등 지급하는 개편안을 검토하고 있다. 기준 중위소득을 지급 기준 상한선으로 정해 중장기적으로 수급자를 줄이는 방안도 추진한다. 기준 중위소득이란 노인뿐 아니라 우리나라 전체 가구 소득을 나열했을 때 중간에 있는 금액이다. 24일 관련 부처에 따르면 정부는 이르면 이번주 청와대에 이 같은 내용의 기초연금 개편 방안을 보고하고 이를 토대로 기초연금법 개정안을 마련할 계획이다. 이재명 대통령이 지난 1월 국무회의에서 기초연금 개편을 지시한 데 따른 후속 조치다. 생계급여 등을 받는 기초생활보장 수급자의 연금 지급액을 높이고, 상한선 위의 ‘잘사는 노인’은 단계적으로 수급 대상에서 제외하는 방안이 거론된다. 올해 기준 기초연금은 65세 이상 노인 중 소득 하위 70%에 월 34만9700원이 지급된다. 부부 감액, 국민연금 연계 감액 등에 따라 가구별 수령액에는 차이가 있지만 기본적으로 하위 70%에 해당하면 소득과 상관없이 같은 금액을 일괄 지급하는 것이 원칙이다. 정부는 하위 70%의 큰 틀은 유지하되 소득 수준에 따라 차등 지급하는 방안을 검토하고 있다. 예컨대 기초생활보장 수급자에게는 기준 금액보다 많이, 그 외에는 적게 지급하는 식이다. 상대적으로 소득 수준이 높은 노인의 수급을 제한하기 위해 지급 기준 상한선을 기준 중위소득으로 설정하는 방안도 검토하고 있다. 재산에 각종 공제를 적용해 산정하는 ‘기초연금 선정 기준액’은 올해 단독가구 기준 247만원으로 중위소득(256만원)의 93.6% 수준까지 올라왔다. 정부는 이 같은 방향을 핵심으로 하는 복수 시나리오를 검토한 뒤 6·3 지방선거 이후 기초연금법 개정안을 공식 발표할 것으로 알려졌다. 정부 관계자는 “최대 30년에 걸쳐 중장기적으로 개편해나가야 하는 사안”이라며 “연내 법안 국회 제출이 목표”라고 했다. 차등지급 추진…기초생보 대상자는 두텁게 지원 李 ""고소득도 34만원 받는게 맞나"" 이재명 대통령은 지난달 국무회의에서 기초연금과 관련해 “월 200만원 이상 소득이 있는 사람도 1인당 34만원을 받는 게 이상한 것 같다”며 “연간 몇조원씩 재정 부담이 늘어나는데 그게 맞느냐”고 말했다. 이 대통령 말처럼 소위 ‘잘사는 노인’도 기초연금을 받게 된 건 지급 기준이 12년째 ‘노인 중 소득 하위 70%’에 묶여 있기 때문이다. 그사이 노인 인구가 1000만 명을 넘어서 기초연금에 들어가는 세금은 20조원 이상으로 불어났다. 이대로면 2050년에는 기초연금 재정지출이 46조원에 달할 것으로 전망된다. 정부가 기초연금 제도 손질에 속도를 내는 배경이다. ◇“하후상박 원칙 구현” 24일 관련 부처에 따르면 올해 기초연금을 받을 것으로 예상되는 노인은 778만8000명에 달한다. 고령자가 급격히 늘어나 2014년 제도 도입 당시 435만3000명에 불과하던 기초연금 수급자가 두 배 가까이로 늘어났다. 같은 기간 소요 예산(국비 기준)도 5조2000억원에서 올해 23조1000억원으로 네 배 이상으로 불어났다. 이미지 크게보기 정부는 당초 ‘소득 하위 70%’ 기준을 60%나 50% 수준으로 낮추는 방안도 검토한 것으로 알려졌다. 하지만 이미 형성된 수급 기대를 감안할 때 기준을 일괄적으로 낮추는 방식은 현실적으로 어렵다고 판단한 것으로 전해졌다. 정부는 그 대신 ‘하위 70%’ 틀은 유지하되 그 안에서 소득 수준에 따라 기초연금을 차등 지급하는 방식에 무게를 두고 있다. 올해 기초연금 지급액은 34만9700원이고 물가상승률 등을 반영해 내년 인상될 예정이다. 이에 맞춰 기초생활보장 수급자와 그외 수급자는 수준에 따라 지급액을 늘리고 줄이는 방안이 거론된다. 올해 생계급여를 받는 노인은 87만 명으로 기초연금 수급자 778만8000명의 11% 수준이다. 정부 관계자는 “국가 재정을 감안하면서도 ‘하후상박’ 원칙을 구현하려면 차등 지급이 가장 현실적인 대안”이라며 “구체적 지급액은 협의를 거쳐 추후 확정할 것”이라고 설명했다. ◇중위소득 ‘캡’ 씌워 수급자 줄인다 기초연금 수급 상한선을 ‘기준 중위소득 100%’로 설정하는 방안도 논의되고 있다. 소득 수준이 전반적으로 높아지면서 ‘하위 70%’ 기준이 사실상 중위소득 100%(전체 가구 소득의 중간값)에 근접한 수준까지 상승한 만큼, 상한선을 둬 시간이 지날수록 이를 초과하는 고소득 노인은 자연스럽게 수급 대상에서 빠지도록 하겠다는 취지다. 올해 기준 중위소득이 256만원인 점을 감안하면 기초연금 선정 기준액(247만원)은 전체 가구 소득 중간값의 96.3% 수준에 이른다. 한국개발연구원(KDI)은 2028년에는 이 기준액이 중위소득 100%에 도달할 것으로 전망했다. 별도 조치 없이 선정 기준액이 중위소득의 120%, 130%까지 상승하면 전체 가구 중간값보다 소득이 높은 노인에게도 수십만원의 연금이 지급되는 구조가 될 수 있다. 중위소득을 상한선으로 정하면 지금 당장 ‘하위 70%’ 틀을 건드리지 않더라도 시간이 지나며 중위소득을 초과하는 노인은 자연스럽게 수급 대상에서 제외된다. 정부 관계자는 “5년 뒤에는 전체 노인의 65%, 10년 뒤에는 60%, 30년 뒤에는 50% 식으로 수급자가 자연스레 줄어들 것으로 전망한다”고 설명했다. KDI는 이 같은 기준을 적용하면 2050년 기초연금 재정지출이 현행 46조원보다 5조원가량 줄어든 41조원이 될 것으로 분석했다. ◇기초연금 선정 기준액도 개편 검토 이외 각종 공제로 느슨해진 기초연금 선정 기준액을 손보는 방안도 논의하고 있다. 현재는 65세 이상 노인의 근로소득에서 116만원을 뺀 값에 70%를 곱하고 재산에 각종 공제를 적용해 ‘월 소득인정액’을 정한다. 이 액수가 단독가구 기준 247만원을 밑돌면 기초연금을 받는다. 예컨대 혼자 사는 65세 이상 노인 A씨에게 다른 재산과 소득은 하나도 없고 오직 상시 근로소득만 있다고 가정하면 A씨는 월 468만원을 꾸준히 벌더라도 기초연금을 받을 수 있다. 정부는 기초연금 소득인정액과 기초생활보장제도의 소득인정액을 연계해 개편하는 방안도 테이블에 올려놓고 있다. 기초생활보장제도는 근로능력 유무를 기준으로 수급자를 선정하기 때문에 기초연금보다 요건이 엄격하다. 다만 제도별 도입 취지와 정책 목표가 다른 만큼 기준액을 일률적으로 맞추는 것은 적절치 않다는 의견도 적지 않은 것으로 알려졌다. 남정민/정영효",https://www.hankyung.com/article/2026022420811,https://img.hankyung.com/photo/202602/02.28495613.3.jpg
2026-02-24,한국경제,national,기초연금 차등 지급…'잘사는 노인' 덜 준다,,정부가 65세 이상 고령자 가운데 소득 하위 70%에 일괄 지급해온 기초연금을 소득에 따라 차등 지급하는 개편안을 검토하고 있다. 기준 중위소득을 지급 기준 상한선으로 정해 중장기적으로 수급자를 줄이는 방안도 추진한다. 기준 중위소득이란 노인뿐 아니라 우리나라 전체 가...,"정부가 65세 이상 고령자 가운데 소득 하위 70%에 일괄 지급해온 기초연금을 소득에 따라 차등 지급하는 개편안을 검토하고 있다. 기준 중위소득을 지급 기준 상한선으로 정해 중장기적으로 수급자를 줄이는 방안도 추진한다. 기준 중위소득이란 노인뿐 아니라 우리나라 전체 가구 소득을 나열했을 때 중간에 있는 금액이다. 24일 관련 부처에 따르면 정부는 이르면 이번주 청와대에 이 같은 내용의 기초연금 개편 방안을 보고하고 이를 토대로 기초연금법 개정안을 마련할 계획이다. 이재명 대통령이 지난 1월 국무회의에서 기초연금 개편을 지시한 데 따른 후속 조치다. 생계급여 등을 받는 기초생활보장 수급자의 연금 지급액을 높이고, 상한선 위의 ‘잘사는 노인’은 단계적으로 수급 대상에서 제외하는 방안이 거론된다. 올해 기준 기초연금은 65세 이상 노인 중 소득 하위 70%에 월 34만9700원이 지급된다. 부부 감액, 국민연금 연계 감액 등에 따라 가구별 수령액에는 차이가 있지만 기본적으로 하위 70%에 해당하면 소득과 상관없이 같은 금액을 일괄 지급하는 것이 원칙이다. 정부는 하위 70%의 큰 틀은 유지하되 소득 수준에 따라 차등 지급하는 방안을 검토하고 있다. 예컨대 기초생활보장 수급자에게는 기준 금액보다 많이, 그 외에는 적게 지급하는 식이다. 상대적으로 소득 수준이 높은 노인의 수급을 제한하기 위해 지급 기준 상한선을 기준 중위소득으로 설정하는 방안도 검토하고 있다. 재산에 각종 공제를 적용해 산정하는 ‘기초연금 선정 기준액’은 올해 단독가구 기준 247만원으로 중위소득(256만원)의 93.6% 수준까지 올라왔다. 정부는 이 같은 방향을 핵심으로 하는 복수 시나리오를 검토한 뒤 6·3 지방선거 이후 기초연금법 개정안을 공식 발표할 것으로 알려졌다. 정부 관계자는 “최대 30년에 걸쳐 중장기적으로 개편해나가야 하는 사안”이라며 “연내 법안 국회 제출이 목표”라고 했다. 남정민",https://www.hankyung.com/article/2026022421161,https://img.hankyung.com/photo/202602/02.28495613.3.jpg
2026-02-24,한국경제,national,"""한낮 싸게, 저녁엔 비싸게""…산업계 95% 전기료 낮아진다",,"정부가 1977년 도입된 계절·시간대별(계시별) 요금체계를 49년 만에 대대적으로 조정한다. 전기가 남는 시간에는 싸게, 부족한 시간에는 비싸게 가격을 매겨 전력 수요를 조정하는 게 골자다. 산업계의 95% 이상이 전기요금 인하 효과를 누릴 것이란 분석이 ...","정부가 1977년 도입된 계절·시간대별(계시별) 요금체계를 49년 만에 대대적으로 조정한다. 전기가 남는 시간에는 싸게, 부족한 시간에는 비싸게 가격을 매겨 전력 수요를 조정하는 게 골자다. 산업계의 95% 이상이 전기요금 인하 효과를 누릴 것이란 분석이 나온다. 이미지 크게보기 24일 정부와 경제계에 따르면 정부는 전기를 많이 쓰는 시간(최대부하), 보통으로 쓰는 시간(중간부하), 적게 쓰는 시간(경부하)으로 구간을 다시 나누고, 사용량에 따라 전력량 요금을 달리 매기는 방식으로 계시별 요금 체계를 손질하기로 했다. 우선 3~10월 평일 기준으로 기존 최대부하였던 오전 11시~낮 12시와 오후 1~3시를 요금을 더 저렴한 중간부하로 변경하고, 반대로 기존 중간부하였던 오후 6~9시는 요금이 더 비싼 최대부하로 바꾼다. 쉽게 말해 한낮의 요금은 내려가고 저녁 요금은 올라간다. 시간대별 요금 단가 자체도 조정된다. 오후 3~9시 최대부하 요금을 깎아주고, 심야(오후 10시~오전 8시) 경부하 요금은 올리는 식이다. 단가 조정 폭이나 주말 할인 폭은 아직 미정이다. 정부는 조만간 확정해 최종안을 발표할 예정이다. 정부 관계자는 “2020년대 들어 태양광 설비가 급증해 한낮에는 전기 공급이 수요를 웃도는 시간이 늘어났고, 전기를 가장 많이 쓰는 시간대도 저녁(오후 6~9시)으로 옮겨갔다”며 “이 같은 변화를 요금제에 반영했다”고 설명했다. 정부는 또 봄(3~5월)·가을(9~10월)의 주말과 공휴일 낮에는 요금을 대폭 깎는 ‘주말 집중 할인’을 3년간 한시적으로 도입한다. 냉난방 수요가 많지 않은 봄가을철 주말 낮에 전력 공급이 수요를 크게 웃돌면서 발전을 일부 멈추는 출력제어가 집중되는 현상을 완화하기 위한 조치다. 지난해 전체 출력제어의 약 90%가 이 시간대에 발생한 것으로 나타났다. 이번 요금 개편의 관건은 사업장마다 전기요금이 저렴한 ‘경부하 시간대’에 전기를 얼마나 사용하는지다. 공장이 1년 내내 24시간 고르게 돌아간다고 가정하면 전체 시간의 약 53%가 전기요금이 싼 시간대에 해당한다. 이 53%보다 사용 비중이 낮은 사업장은 전체 요금이 줄어들 가능성이 크다. 약 4만 개 국내 사업장 중 이런 조건에 해당하는 곳은 95% 이상으로 추산된다. 업종별 유불리는 엇갈린다. 경부하 시간대 사용 비중이 높은 철강·시멘트 업종은 상대적으로 불리하다. 이들 업체 중 일부는 낮에 자가발전기를 가동하고 심야 시간대에 공장 가동률을 높여 왔는데, 경부하 요금 인상으로 부담이 커질 수 있기 때문이다. 특히 전력 사용량이 많은 일부 대형 사업장은 인하 폭이 제한되거나 오히려 인상될 가능성도 있다. 반면 석유화학 업종은 365일 24시간 공장을 비교적 일정하게 가동하는 특성이 있어 요금 인하 효과를 누릴 것으로 평가된다. 낮 시간대 전기 사용 비중이 상대적으로 높은 반도체·자동차 업계 등도 인하 효과를 볼 가능성이 크다. 정연제 서울과학기술대 교수는 “태양광 발전이 늘어나면 전기가 남는 시간대가 더 확대될 수 있다”며 “그 경우 지금의 ‘싼 시간대’보다도 중간 시간대 요금을 더 낮추는 방안까지 검토해야 한다”고 말했다. 또 “봄가을 주말에만 3년 동안 한시적으로 할인하는 방식은 기업이 장기 계획을 세우기 어렵게 만든다”며 “구조적으로 정착시키는 방안을 고민할 필요가 있다”고 지적했다. 김리안 기자",https://www.hankyung.com/article/2026022420801,https://img.hankyung.com/photo/202602/AA.43402236.3.jpg
2026-02-24,한국경제,national,"경제계 ""대미투자법 조속히 통과시켜야""",,미국 연방대법원의 상호관세 위법 판결에도 경제계는 보복관세와 추가 품목관세 등 미국의 강한 무역 제재 가능성을 우려하고 있다. 경제계는 여야 합의 처리 시한인 오는 3월 9일 이전에 대미투자특별법을 통과시켜달라고 촉구했다.성 김 현대자동차그룹 전략기획담당 사장은 24일 국회에서 열린 대미투자특별법안 관련 경제계 조찬간담회에서 “국제비상경제권한법(...,미국 연방대법원의 상호관세 위법 판결에도 경제계는 보복관세와 추가 품목관세 등 미국의 강한 무역 제재 가능성을 우려하고 있다. 경제계는 여야 합의 처리 시한인 오는 3월 9일 이전에 대미투자특별법을 통과시켜달라고 촉구했다. 성 김 현대자동차그룹 전략기획담당 사장은 24일 국회에서 열린 대미투자특별법안 관련 경제계 조찬간담회에서 “국제비상경제권한법(IEEPA) 위법 판결이 나왔지만 무역확장법 232조 규정으로 자동차·철강에 부과되는 관세는 그대로 유지될 가능성이 높다”고 말했다. 이날 간담회에는 김상훈 국회 대미투자특별위원장을 포함한 국회의원과 재계 인사들이 참석했다. 박수영 국민의힘 의원은 비공개 간담회가 끝난 뒤 기자들과 만나 “성 김 사장이 미국에서 정부 인사들을 만나 보니 오히려 관세 압박이 더 가속화할 우려가 있다는 인상을 받았다고 했다”고 전했다. 박 의원은 “대미투자특별법 통과를 늦추면 산업계가 더 큰 피해를 볼 수 있다는 이야기도 나왔다”고 말했다. 안대규 기자,https://www.hankyung.com/article/2026022420551,
