date,press,region,title,sub_title,description,content,article_url,image_url
2026-02-25,충청투데이,chungcheong,수확량 12% 올리는 깻잎 수경재배 비결 찾았다,"금산군농업기술센터, 스마트팜 ‘최적 상토 비율’ 데이터 확보","[충청투데이 이상문 기자] 금산군농업기술센터가 잎들깨 수경재배의 생산 효율을 극대화하기 위해 상토 구성비와 조합 비율에 관한 정밀 실증 데이터를 확보했다. 이번 분석은 2024년 11월부터 지난해 8월까지 총 9개월간 6개의 실증용 재배대(각 6.7㎡)를 동일 환경 조건으로 운영하며 진행됐다.실증 결과, 상토 구성비에 따른 생산성 격차가 뚜렷하게 나타났다. 펄라이트, 코코피트, 피트모스를 3:3:3 비율로 조합했을 때 연간 수확량은 53.24kg으로 전체 평균 대비 11.7% 증가하여 가장 높은 생산 효율을 보였다. 반면 펄라이트와","금산군농업기술센터, 스마트팜 ‘최적 상토 비율’ 데이터 확보 [충청투데이 이상문 기자] 금산군농업기술센터가 잎들깨 수경재배의 생산 효율을 극대화하기 위해 상토 구성비와 조합 비율에 관한 정밀 실증 데이터를 확보했다. 이번 분석은 2024년 11월부터 지난해 8월까지 총 9개월간 6개의 실증용 재배대(각 6.7㎡)를 동일 환경 조건으로 운영하며 진행됐다. 실증 결과, 상토 구성비에 따른 생산성 격차가 뚜렷하게 나타났다. 펄라이트, 코코피트, 피트모스를 3:3:3 비율로 조합했을 때 연간 수확량은 53.24kg으로 전체 평균 대비 11.7% 증가하여 가장 높은 생산 효율을 보였다. 반면 펄라이트와 코코피트의 비율을 5:5로 적용했을 때는 47kg으로 평균 대비 1.3% 감소하였고, 7:3 비율에서는 44.47kg으로 평균 대비 6.7%의 생산성 저하가 확인됐다. 이번 데이터는 단순한 수확량 비교를 넘어 상토 물리성에 따른 급·배액 관리의 중요성을 시사한다. 가장 높은 생산성을 보인 3:3:3 혼합비는 유기물 비율이 높아 상토의 수분 함량이 상대적으로 높게 유지되는 특성이 있다. 이는 초기 생육에는 유리하나 수분 함량이 과도할 경우 엽무름증 발생 가능성이 있다는 점을 고려해야 한다. 따라서 상토별 물리적 특성에 따른 수확 전후의 수분 관리 기술과 급·배액 시스템의 최적화가 필수적이다. 금산군농업기술센터 관계자는 “이번 실증 분석 데이터는 잎들깨 스마트팜 재배의 기술적 완성도를 높이는 중요한 이정표가 될 것”이라며 “단순한 혼합비 도출을 넘어 생산성 향상 방향을 구체화하기 위해 수확 전후 급·배액 관리 및 수확 후 관리 기술에 대한 추가적인 관리 방안 검토와 지속적인 현장 실증이 필요하다”고 설명했다. 또한 “앞으로 농가 적용이 가능한 최적 모델을 조속히 개발해 보급함으로써 금산 잎들깨 산업의 경쟁력을 확보하는 데 최선을 다하겠다”고 덧붙였다. 금산군농업기술센터는 전국 최초로 재배대 형태의 수경재배 기술을 도입한 이후, 농촌진흥청 및 충남농업기술원과 협력하여 스마트팜 재배 기술 고도화에 주력하고 있다. 확보된 이번 실증 데이터는 잎들깨 재배 매뉴얼 제작 및 농가 보급형 모델 개발의 핵심 지표로 활용될 예정이다. 센터는 향후 수확 전후 관리 기술을 정교화하고, 농가가 현장에서 직접 적용 가능한 급·배액 관리 방안을 검토하여 지속적인 현장 실증을 추진할 계획이다. 이상문 기자",https://www.cctoday.co.kr/news/articleView.html?idxno=2226128,https://cdn.cctoday.co.kr/news/thumbnail/202602/2226128_679432_5502_v150.jpg
2026-02-25,충청투데이,chungcheong,단기 화제성에 그쳐…청년 상인 지원 조례 제정해야 [사라진 청년몰],[사라진 청년몰…방치공간 재설계 필요] 창업서 벗어나 관문형 콘텐츠로 재설계 청년 상인 키워 실질적 세대교체 이뤄야,"[충청투데이 김세영 기자] 청년몰이 입지 한계와 전략 없는 단기 화제성으로 지속성을 확보하지 못했다는 분석이 나온다.전문가들은 고령화로 쇠퇴하는 전통시장의 활력 제고를 위해 청년몰을 창업 또는 관광 생태계 거점으로 전환해야 한다는 데 입을 모은다.더불어 해당 정책의 실효성 확보를 위해 청년 상인 육성 지원 조례를 제정하고 실행 구조와 재정, 운영체계를 포함한 정책 설계가 병행돼야 한다는 의견이다.먼저 유통업계 전문가는 방치된 청년몰 공간을 단순히 실패한 상가가 아닌 기반 시설이 갖춰진 도시재생의 전략적 거점으로 재해석해야 한다고 조","[사라진 청년몰…방치공간 재설계 필요] 창업서 벗어나 관문형 콘텐츠로 재설계 청년 상인 키워 실질적 세대교체 이뤄야 [충청투데이 김세영 기자] 청년몰이 입지 한계와 전략 없는 단기 화제성으로 지속성을 확보하지 못했다는 분석이 나온다. 전문가들은 고령화로 쇠퇴하는 전통시장의 활력 제고를 위해 청년몰을 창업 또는 관광 생태계 거점으로 전환해야 한다는 데 입을 모은다. 더불어 해당 정책의 실효성 확보를 위해 청년 상인 육성 지원 조례를 제정하고 실행 구조와 재정, 운영체계를 포함한 정책 설계가 병행돼야 한다는 의견이다. 먼저 유통업계 전문가는 방치된 청년몰 공간을 단순히 실패한 상가가 아닌 기반 시설이 갖춰진 도시재생의 전략적 거점으로 재해석해야 한다고 조언한다. 김기평 대전대학교 물류유통학과 교수는 ""대전과 충남 천안의 청년몰 모두 기차역 인접이라는 지리적 이점이 콘텐츠 경쟁력 부족, 동선 단절, 통과 역세권 등의 문제로 집객 효과를 잃었다""며 ""지속 가능성을 확보하기 위해선 해당 공간을 창업 생태계 허브로 조성해야 한다""고 말했다. 이어 ""개별 점포 중심의 창업에서 벗어나 지역 콘텐츠를 제작하는 로컬크리에이터들의 공유 오피스 또는 주민 밀착형 커뮤니티 복합문화공간, 단기 팝업스토어, 테스트베드 전용 공간으로 전환해야 시장 안의 고립된 섬이 되지 않는다""고 강조했다. 관광경영 측면에서 청년몰을 도시 첫 경험을 만드는 관문형 콘텐츠로 재설계해 구도심 상권에 숨을 불어넣을 필요가 있다는 목소리도 나온다. 김주호 배재대 관광경영학과 교수는 ""과거 청년몰은 중장기적 전략 없이 방송 화제성을 유발해 관심을 끌었다""며 ""당초 도시 안의 섬과 같은 청년몰 입지를 분석하고 업종 구성을 해야 했는데 그러지 못해 상권과 컨셉이 미스매치가 됐다""고 분석했다. 이어 ""해당 공간을 단순히 임대공간으로 본다면 공공의 관점에서 걱정할 필요가 없겠지만 도시재생 관점에서 본다면 관광콘텐츠가 단계적으로 들어갈 필요가 있다""며 ""대전의 청년몰 위치는 대전역과 성심당 사이에 있으니 과학우주 또는 큰 축제의 쇼케이스 등을 주제로 대전의 첫 경험 공간을 조성하면 좋을 것으로 보인다""고 제언했다. 일각에서는 정책의 지속성 확보를 위한 청년 상인 육성 제도화 필요성을 대두한다. 전통시장의 소비자와 상인 모두 고령화하는 상황에서 청년 상인을 육성해야 실질적인 세대교체가 이뤄질 것이란 판단에서다. 김주회 대전대학교 대학원 융합컨설팅학과 교수는 ""많은 청년몰이 점포 집합 형태로 조성됐으나 통합마케팅, 공동브랜딩, 데이터 기반 매출 관리 등 상권 단위의 운영 전략이 체계적으로 작동하지 못했다""며 ""입지가 다소 불리하더라도 운영이 강하면 상권은 살아날 수 있다""고 설명했다. 그러면서 김 교수는 ""조례에 5년 단위 기본계획 및 연도별 시행계획 수립을 명문화해야 한다""며 ""실효성을 위해선 중장기 계획 의무화, 전문 운영체계 구축, 성과지표 기반 관리, 재도전 구조 마련, 기존 상권과의 통합 장치를 포함해야 한다""고 강조했다. 김세영 기자",https://www.cctoday.co.kr/news/articleView.html?idxno=2226107,https://cdn.cctoday.co.kr/news/thumbnail/202602/2226107_679408_1846_v150.jpg
2026-02-25,충청투데이,chungcheong,청년몰 폐업…사업구조부터 바꿔야 [사라진 청년몰],[사라진 청년몰…방치공간 재설계 필요] 1000억 들인 청년몰 줄줄이 폐업 충청권 청년몰 폐업률 69.5％달해 낮은 접근성·자생력 부족 등 원인 방치된 유휴공간들 재설계 나서야,"[충청투데이 김세영 기자] 정부가 예산 약 1000억원을 들여 지원한 청년몰이 절반가량 폐업하면서 사업 구조 전반에 대한 재설계 필요성이 제기된다.상권 활성화를 목표로 도입됐지만, 폐업 이후 공실이 장기간 방치되며 오히려 시장 침체를 부추기고 있어서다.일각에서는 단순 점포 채우기식 창업지원에서 벗어나 상권 활성화 거점으로 기능 전환이 필요하다는 의견이다.24일 중소벤처기업부 등에 따르면 지난해 6월 기준 전국 청년몰 점포 578곳 중 260곳(45％)이 휴·폐업 상태인 것으로 나타났다.이는 사업 이후 청년몰 점포 수가 가장 많았던","[사라진 청년몰…방치공간 재설계 필요] 1000억 들인 청년몰 줄줄이 폐업 충청권 청년몰 폐업률 69.5％달해 낮은 접근성·자생력 부족 등 원인 방치된 유휴공간들 재설계 나서야 [충청투데이 김세영 기자] 정부가 예산 약 1000억원을 들여 지원한 청년몰이 절반가량 폐업하면서 사업 구조 전반에 대한 재설계 필요성이 제기된다. 상권 활성화를 목표로 도입됐지만, 폐업 이후 공실이 장기간 방치되며 오히려 시장 침체를 부추기고 있어서다. 일각에서는 단순 점포 채우기식 창업지원에서 벗어나 상권 활성화 거점으로 기능 전환이 필요하다는 의견이다. 24일 중소벤처기업부 등에 따르면 지난해 6월 기준 전국 청년몰 점포 578곳 중 260곳(45％)이 휴·폐업 상태인 것으로 나타났다. 이는 사업 이후 청년몰 점포 수가 가장 많았던 2020년 휴·폐업률 38％보다 높아진 수치다. 지난달 기준 전국 청년몰의 평균 공실률은 33.8％로, 점포 3곳 중 1곳이 폐업으로 불이 꺼진 상태다. 지역의 상황은 더욱 심각하다. 충청권에는 대전 중앙메가프라자, 충남 천안명동대흥로상점가·금산시장, 충북 제천중앙시장·관아골상가 등 권역 5곳에 점포 82곳이 조성됐다. 그러나 2021년 중앙메가프라자와 제천중앙시장 내 청년몰이 문을 닫았고 지난해에는 천안명동대흥로상점가 청년몰이 폐업했다. 현재 운영 중인 금산시장과 관아골상가도 일부 점포(8곳)가 문을 닫으면서 충청권 청년몰 폐업률은 무려 69.5％(57곳)를 기록 중이다. 당초 청년몰 조성 사업은 전통시장에 청년 창업자를 유입해 유동인구를 늘리고 노후 상권을 활성화하겠다는 취지로 2016년 도입됐다. 지난해 상반기까지 투입된 총 예산이 약 974억원에 이르지만, 지원이 시설 개선과 임대료 보전에 집중되면서 지속적인 경영 지원과 판로 확보로 이어지지 못했다는 평가가 나온다. 또 유사 업종 중심의 점포 구성, 시장 외곽이나 2층 등 낮은 접근성, 지원 종료 이후 자생력 부족 등도 복합적으로 작용했다. 문제는 폐업 이후 유휴공간이 방치되며 시장 전체 이미지 저하로 이어지고 있다는 점이다. 대전 중앙메가프라자는 폐업 이후 복합문화공간으로의 전환이 시도됐지만 상권 회복으로 이어지지 못해 결국 방치되고 있다. 공실이 늘어나면서 유동인구가 줄고 기존 상인의 매출도 감소하는 등 악순환이 반복되는 실정이다. 지속적인 방치는 전통시장 경쟁력을 더욱 약화시킬 수 있는 만큼 단순 점포 재입점이 아닌 도시재생 거점으로의 기능 전환이 필요하다는 목소리가 나온다. 지역 경제계 전문가는 ""청년몰 폐업 이후 상권이 눈에 띄게 낙후되고 있다. 상권 소비자, 상인 연령이 고령화하면서 경쟁력도 잃어가고 있다""며 ""청년몰을 시장과 연계한 문화·창업 공간 등 새로운 상권 활성화 거점으로 활용할 방안을 마련해야 할 때다""고 강조했다. 김세영 기자",https://www.cctoday.co.kr/news/articleView.html?idxno=2226105,https://cdn.cctoday.co.kr/news/thumbnail/202602/2226105_679407_1819_v150.jpg
2026-02-25,충청투데이,chungcheong,한때만 활기…상권 죽은지 오래 [사라진 청년몰],[사라진 청년몰…방치공간 재설계 필요] 대전 중앙메가프라자 가보니 청년구단 폐업 후 남은 ‘디캔센터’ 공실 상권 쇠퇴… 주변 점포 상인들 한숨 푹푹,"[충청투데이 김세영 기자] “손님 못 본 지 꽤 됐어요. 사람 북적했던 예전이 그립습니다.”20일 오후 1시경 대전 동구 중앙메가프라자.한때 방송 프로그램에 소개되며 전국적인 관심을 모았던 청년몰 ‘청년구단’이 자리했던 공간을 방문했지만 반기는 이 없이 어두컴컴했다.그저 입구의 빛바랜 간판과 건물 내부에 남은 홍보물만이 과거의 영광을 전하고 있었다.청년구단은 매출 감소 등의 이유로 2021년 5월 폐업했다.이후 여러 업체가 들어왔다 나가고, 복합문화공간 ‘디캔센터’로도 사용됐지만 사람 발길이 닿지 않으면서 결국 개미 한 마리 다니지","[사라진 청년몰…방치공간 재설계 필요] 대전 중앙메가프라자 가보니 청년구단 폐업 후 남은 ‘디캔센터’ 공실 상권 쇠퇴… 주변 점포 상인들 한숨 푹푹 [충청투데이 김세영 기자] “손님 못 본 지 꽤 됐어요. 사람 북적했던 예전이 그립습니다.” 20일 오후 1시경 대전 동구 중앙메가프라자. 한때 방송 프로그램에 소개되며 전국적인 관심을 모았던 청년몰 ‘청년구단’이 자리했던 공간을 방문했지만 반기는 이 없이 어두컴컴했다. 그저 입구의 빛바랜 간판과 건물 내부에 남은 홍보물만이 과거의 영광을 전하고 있었다. 청년구단은 매출 감소 등의 이유로 2021년 5월 폐업했다. 이후 여러 업체가 들어왔다 나가고, 복합문화공간 ‘디캔센터’로도 사용됐지만 사람 발길이 닿지 않으면서 결국 개미 한 마리 다니지 않는 공실로 전락했다. 디캔센터는 대전문화예술네트워크협동조합이 유휴공간을 활용해 조성한 곳으로, 지난해 대전문화재단과 지역 예술인을 대상으로 무료 대관 사업을 진행하며 잠시 활기를 띠기도 했다. 그러나 사업이 종료되고 협동조합 사무실이 서구 갈마동으로 이전하면서 다시 빛을 잃었다. 복도에는 적막만이 맴돌았고, 출입문은 잠금장치조차 걸려 있지 않아 보안이 취약했다. 을씨년스러운 분위기에 같은 층에 입점한 점포 상인들의 한숨은 깊어졌다. 40년째 중앙시장에서 한복점을 운영 중인 최수년(89) 씨는 “청년구단 있을 때는 사람이 많았는데 지금은 가게가 많이 비어 장사가 안 된다”며 “코로나19 때보다 장사가 안돼 힘들다. 뭐라도 들어와 예전처럼 활기를 띠면 좋을 것 같다”고 말했다. 실제 건물 내부는 층별로 공실이 늘어나며 상권 기능이 크게 약화된 모습이었다. 일부 점포만 영업을 이어가고 있었고 상당수 공간은 창고처럼 활용되거나 비어 있었다. 청년몰이 전통시장 유입 효과를 만들지 못한 채 단기 창업 지원에만 머물렀다는 지적이 나오는 이유다. 이에 현장에서는 청년몰 폐업 이후 방치된 유휴공간을 도시재생 자산으로 전환할 수 있는 방안을 모색해야 한단 의견이 나온다. 배종남 신중앙시장상인회장은 “청년몰이 창업 지원 역할은 했지만 상권 활성화로 이어지지는 못했다”며 “3층이라는 입지 자체가 발길을 끌기 어려웠고 단기 지원에 그치면서 자리를 잡기 전에 문을 닫는 구조였다”고 말했다. 이어 “최소 2년 이상 안정적으로 운영할 수 있도록 지원하고 입지 선정과 업종 구성부터 다시 검토해야 한다”며 “방치된 공간을 그대로 둘 것이 아니라 시장과 연계한 활용 방안을 찾아야 한다”고 강조했다. 김세영 기자",https://www.cctoday.co.kr/news/articleView.html?idxno=2226088,https://cdn.cctoday.co.kr/news/thumbnail/202602/2226088_679378_1412_v150.jpg
2026-02-24,충청투데이,chungcheong,"충북 교복값도 5년새 40% 폭등…윤건영 ""생활복 형식으로 바꾼다""","중학교 2020년 24만원→2025년 34만원…생활복은 별도 교육청 ""실용위주… 학생 활동성·학부모 경제적 부담 고려""",[충청투데이 강준식 기자] 윤건영 충북도교육감의 ‘실용’ 정책이 실용주의를 강조하는 이재명 정부와 궤를 같이하는 모양새다. 윤 교육감과 이재명 대통령 모두 새 학기를 앞두고 천정부지로 오르고 있는 교복값 바로 잡기에 나서면서다.윤 교육감은 지난 13일 학부모와 학생들의 의견을 수렴해 정장 형식의 학교 교복을 생활복 형식으로 바꾸는 정책을 확대 추진하기로 했다. 올해 초 밝힌 ‘실용과 포용의 충북교육 대전환’의 후속 정책이다.그는 임기 초반부터 교복업체의 부정 입찰 의혹 감사에 나서는 등 교복값의 지나친 인상을 극도로 경계했다. 학부,"중학교 2020년 24만원→2025년 34만원…생활복은 별도 교육청 ""실용위주… 학생 활동성·학부모 경제적 부담 고려"" [충청투데이 강준식 기자] 윤건영 충북도교육감의 ‘실용’ 정책이 실용주의를 강조하는 이재명 정부와 궤를 같이하는 모양새다. 윤 교육감과 이재명 대통령 모두 새 학기를 앞두고 천정부지로 오르고 있는 교복값 바로 잡기에 나서면서다. 윤 교육감은 지난 13일 학부모와 학생들의 의견을 수렴해 정장 형식의 학교 교복을 생활복 형식으로 바꾸는 정책을 확대 추진하기로 했다. 올해 초 밝힌 ‘실용과 포용의 충북교육 대전환’의 후속 정책이다. 그는 임기 초반부터 교복업체의 부정 입찰 의혹 감사에 나서는 등 교복값의 지나친 인상을 극도로 경계했다. 학부모 가계 부담에 가장 큰 영향을 끼치기 때문이다. 이런 가운데 이 대통령은 지난 12일 수석보좌관 회의에서 고가의 교복값을 학부모들의 ‘등골 브레이커’로 지적하는 등 직접적으로 교복값 문제를 언급했다. 이후 지난 20일 교육부 등 정부부처는 ‘교복 제도 관련 부처별 대응 방안’을 주제로 합동회의를 여는 등 본격적인 교복값 인하 움직임을 보이고 있다. 6·3전국동시지방선거 시·도교육감 출마 예정자들도 교복값 부담 완화 관련 공약을 앞다퉈 내면서 ‘교복값 인하’가 사회 문제로 떠오르고 있다. 윤 교육감이 정장 형태의 교복을 생활복으로 바꾸려는 이유는 낮은 착용 빈도, 원단 가격으로 인한 비싼 구매 비용, 성장기 학생들의 잦은 교복 교체 주기다. 실제 지난해 충북지역 중학교 131곳 중 교복 미착용 학교 등 12곳을 제외한 119곳의 동복 평균 가격은 24만원, 하복까지 포함하면 34만원 수준이다. 이는 모두 1벌씩 구매한 경우로, 학생들의 성장을 고려해 최소 2벌 이상을 재구매할 때 비용은 더 비싸진다. 고등학교의 경우 80곳의 동복 평균 가격과 하복 포함 평균 가격도 각각 24만원과 34만원 수준으로 중학교 교복값과 비슷하다. 2020년 중학교와 고등학교의 교복값 평균 가격(하복 포함)이 각각 24만원과 26만원 수준이었던 것과 비교하면 5년 새 중학교 교복값은 40%, 고등학교는 각 26%가량 각각 올랐다. 여기에 체육복과 생활복 혼용 학교의 경우 생활복까지 구매해야 해 학부모 가계 부담이 갈수록 커지는 형태다. 윤 교육감은 형식적 정장 위주의 교복 체계를 개선하고, 학생들이 일상에서 상시 편안하게 착용할 수 있는 실용적 생활복 중심 교복의 전환을 대안으로 제시했다. 생활복 교복은 수선이 어려운 정장형 교복보다 교체 주기가 길어지고, 구매 가격도 낮아지는 등 학부모들의 ‘이중 지출’ 문제를 해결할 수 있다는 설명이다. 그는 ""교복은 학생들이 학교생활을 하는 동안 가장 오랜 시간 입는 옷""이라며 ""학생들의 활동성과 편안함, 학부모의 경제적 부담을 함께 고려해야 한다""고 강조했다. 문제는 교복 형태의 변경 자율권이 각급 학교에 있다는 점이다. 교복 규정을 학칙으로 정하고 있어 학생들은 이를 따라야 한다. 단위학교는 학생, 학부모, 교직원 등 ‘교육 3주체’ 의견을 종합해 학칙을 변경할 수 있다. 결국 의견수렴 과정을 거쳐야 한다. 충북교육청 관계자는 ""교복을 사러 가면 학부모들은 더 살 수밖에 없는 상황""이라며 ""생활복 도입은 ‘교육 3주체’가 각자 여건에 맞게 교복을 직접 결정하라는 의미를 담고 있다""고 말했다. 강준식 기자",https://www.cctoday.co.kr/news/articleView.html?idxno=2226092,https://cdn.cctoday.co.kr/news/thumbnail/202602/2226092_679397_348_v150.jpg
2026-02-24,충청투데이,chungcheong,대전·세종·충남 소비심리 소폭 하락…경제 불황에 기대심리 둔화,소비자심리지수 전월보다 0.3p 하락 경기·가계 저축 인식 개선 흐름 물가 및 자산 관련 기대 떨어져,"[충청투데이 김세영 기자] 물가 부담과 대내외 경제 불확실성이 이어지면서 대전·세종·충남 소비자심리가 소폭 하락했다.24일 한국은행 대전세종충남본부에 따르면 이달 소비자심리지수(CCSI)는 112.3으로 전월(112.6)보다 0.3p 하락했다.같은 기간 전국(112.1)보다 0.2p 높은 수준이다.소비자심리지수는 100을 기준으로 이를 웃돌면 장기 평균보다 낙관적임을 의미한다.대전·세종·충남 소비자심리지수는 지난해 11월(113.4) 하반기 최고치를 기록했다가 12월 112, 지난달 112.6로 낮아졌다.세부 지표를 살펴보면 가계","소비자심리지수 전월보다 0.3p 하락 경기·가계 저축 인식 개선 흐름 물가 및 자산 관련 기대 떨어져 [충청투데이 김세영 기자] 물가 부담과 대내외 경제 불확실성이 이어지면서 대전·세종·충남 소비자심리가 소폭 하락했다. 24일 한국은행 대전세종충남본부에 따르면 이달 소비자심리지수(CCSI)는 112.3으로 전월(112.6)보다 0.3p 하락했다. 같은 기간 전국(112.1)보다 0.2p 높은 수준이다. 소비자심리지수는 100을 기준으로 이를 웃돌면 장기 평균보다 낙관적임을 의미한다. 대전·세종·충남 소비자심리지수는 지난해 11월(113.4) 하반기 최고치를 기록했다가 12월 112, 지난달 112.6로 낮아졌다. 세부 지표를 살펴보면 가계 재정 여건에 대한 평가부터 엇갈렸다. 현재생활형편 CSI는 99로 전월보다 2p 상승했고 생활형편전망 CSI도 104로 1p 올랐다. 반면 가계수입전망 CSI는 105로 1p 하락했고 소비지출전망 CSI는 108로 3p 떨어져 지출 확대 기대는 다소 약화됐다. 경기에 대한 인식은 개선 흐름을 보였다. 현재경기판단 CSI는 94로 전월보다 3p 상승했고 향후경기전망 CSI는 100으로 기준선을 유지했다. 취업기회전망 CSI도 93으로 3p 올랐지만 금리수준전망 CSI는 104로 1p 하락했다. 가계 저축 인식은 개선됐다. 현재가계저축 CSI는 104로 2p, 가계저축전망 CSI는 106으로 3p 상승했다. 현재가계부채 CSI는 99로 변동이 없었으며 가계부채전망 CSI는 98로 2p 올랐다. 물가와 자산 관련 기대는 낮아졌다. 물가수준전망 CSI는 141로 2p 하락했지만 여전히 높은 수준을 유지했다. 주택가격전망 CSI는 106으로 15p 급락했고 임금수준전망 CSI도 118로 3p 내려 향후 소득 증가 기대가 약화된 것으로 나타났다. 한편 이번 조사는 대전·세종·충남 700가구 가운데 582가구를 대상으로 지난 4일부터 11일까지 실시됐다. 김세영 기자",https://www.cctoday.co.kr/news/articleView.html?idxno=2226085,https://cdn.cctoday.co.kr/news/thumbnail/202602/2226085_679386_4338_v150.jpg
