date,press,region,title,sub_title,description,content,article_url,image_url
2026-02-06,충청투데이,chungcheong,수도권서 멀수록 더 준다…지방 첨단산업 투자 거리비례 지원,"국가첨단전략산업 특화단지 인프라 지원 2배 확대 충남 천안.아산, 충북 청주 특화단지 지원 청신호","[충청투데이 이승동 기자] 정부가 지방의 전략산업 육성을 위해 수도권에서 멀수록 기반시설 구축비를 더 많이 지원하는 방안을 추진한다.그간 수도권 집중을 심화시킨 규모의 논리에 맞서 지리적 불리함을 재정 지원으로 보상한다는 정책 전환이다.기획예산처와 산업통상부는 6일 '국내 산업 경쟁력 제고를 위한 재정지원 간담회'를 열고 국가첨단전략산업 특화단지 인프라 국비 지원 한도를 현행보다 2배로 대폭 확대하는 방안을 검토하기로 했다.핵심은 거리비례 지원으로, 수도권에서 멀리 떨어진 지방에 투자하면 도로, 용수, 폐수, 전력 등 기반시설 구축","국가첨단전략산업 특화단지 인프라 지원 2배 확대 충남 천안.아산, 충북 청주 특화단지 지원 청신호 [충청투데이 이승동 기자] 정부가 지방의 전략산업 육성을 위해 수도권에서 멀수록 기반시설 구축비를 더 많이 지원하는 방안을 추진한다. 그간 수도권 집중을 심화시킨 규모의 논리에 맞서 지리적 불리함을 재정 지원으로 보상한다는 정책 전환이다. 기획예산처와 산업통상부는 6일 '국내 산업 경쟁력 제고를 위한 재정지원 간담회'를 열고 국가첨단전략산업 특화단지 인프라 국비 지원 한도를 현행보다 2배로 대폭 확대하는 방안을 검토하기로 했다. 핵심은 거리비례 지원으로, 수도권에서 멀리 떨어진 지방에 투자하면 도로, 용수, 폐수, 전력 등 기반시설 구축 비용의 정부 지원을 늘린다는 구상이다. 정부는 2023년 전국 7개 지역을 국가첨단전략산업 특화단지로 지정, 2042년까지 민간투자 총 614조원을 뒷받침하기로 했다. 충청권에선 충남 천안·아산(디스플레이), 충북 청주(이차전지)가 포함됐고, 경기 용인·평택(반도체), 경북 포항(철강·이차전지) 등이다. 문제는 지방으로 갈수록 기반시설 구축 부담이 커지는 것인데, 수도권에서 먼 지역의 경두 대규모 투자 유치 시 처음부터 새로 구축해야 하는 경우가 많다. 삼성전자 용인 클러스터의 경우 2030년 말 가동을 위해서 0.4GW의 전력이 우선 필요한 것으로 예상됐다. 기획예산처는 지난해 4월 '글로벌 반도체 경쟁력 선점을 위한 재정투자 강화방안'에서 투자규모 100조원 이상 특화단지의 인프라 국비 지원 한도를 500억원에서 1000억원으로 상향했다. 이번 거리비례 지원 조치는 한 걸음 더 나아가 최대 2000억원까지 확대하고 수도권과 거리에 따라 차등 지원하겠다는 것이다. 정부는 상반기 중 국가첨단전략산업위원회 의결을 거쳐 기업 투자규모를 확정하고, 한도가 상향된 구축비용을 지원할 계획이다. 반도체특별법 제정에 따라 반도체 특별회계 신설 등 후속작업도 계획대로 진행하겠다는 방침이다. 산업통상부 오승철 기획조정실장은 “주요국들이 보조금 등 재정지원을 산업정책의 핵심수단으로 활용하는 상황에서 우리도 산업 현장의 애로를 재정과 적극적으로 연결하는 구조적 논의가 필요하다”며 “기획예산처와 함께 산업 경쟁력 강화를 뒷받침하는 책임있는 정책을 발굴해 나갈 것”이라고 말했다. 이승동 기자",https://www.cctoday.co.kr/news/articleView.html?idxno=2225357,https://cdn.cctoday.co.kr/news/thumbnail/202602/2225357_678376_2949_v150.jpg
2026-02-06,충청투데이,chungcheong,음성형 소상공인 지원자금 2차 실시…50억 규모,9일부터 접수…고령·장애인은 예약없이 방문 신청 가능 착한가격업소 인센티브 지원사업 등 다양한 정책 이어가,"[충청투데이 김영 기자] 음성군은 고물가·고금리 등으로 경영 부담이 커진 관내 소상공인을 돕기 위해 음성형 소상공인 지원자금 2차분 50억원을 9일부터 접수한다. 이번 지원은 2026년도 총 115억원 규모 사업비 중 2차 지원분이다.지원 대상은 관내에 사업장을 둔 소상공인이다. 충북신용보증재단의 신용보증을 받은 뒤 금융기관으로부터 최대 5000만원 이내의 대출을 받을 경우, 최대 5년간 연 3% 범위 내 이자를 지원받을 수 있다. 단, 금융·보험업을 비롯해 사치·향락적 소비 또는 투기를 조장하는 업종과 휴·폐업 업체는 지원 대상에","9일부터 접수…고령·장애인은 예약없이 방문 신청 가능 착한가격업소 인센티브 지원사업 등 다양한 정책 이어가 [충청투데이 김영 기자] 음성군은 고물가·고금리 등으로 경영 부담이 커진 관내 소상공인을 돕기 위해 음성형 소상공인 지원자금 2차분 50억원을 9일부터 접수한다. 이번 지원은 2026년도 총 115억원 규모 사업비 중 2차 지원분이다. 지원 대상은 관내에 사업장을 둔 소상공인이다. 충북신용보증재단의 신용보증을 받은 뒤 금융기관으로부터 최대 5000만원 이내의 대출을 받을 경우, 최대 5년간 연 3% 범위 내 이자를 지원받을 수 있다. 단, 금융·보험업을 비롯해 사치·향락적 소비 또는 투기를 조장하는 업종과 휴·폐업 업체는 지원 대상에서 제외된다. 2차 신청은 오는 9일부터 자금 소진 시까지 진행되며, 3차 50억원 규모의 지원은 7월 1일부터 접수한다. 신청은 ‘보증드림 앱’을 통한 비대면 방식 또는 충북신용보증재단 홈페이지에서 방문 상담을 예약한 뒤 진행할 수 있다. 자세한 사항은 충북신용보증재단 혁신도시지점(249-5770)으로 문의하면 된다. 현연호 일자리경제과장은 “경영에 어려움을 겪는 소상공인들에게 실질적인 도움이 되길 바란다”며 “앞으로도 현장의 목소리를 반영한 실효성 있는 지원 정책을 지속적으로 추진해 나가겠다”고 말했다. 한편 군은 소상공인들을 위해 △소상공인 경영환경 패키지 개선사업 △출산지원 시범사업 △노란우산 공제 희망장려금 지원 △착한가격업소 인센티브 지원 △행복페이 카드수수료 지원사업 등을 추진하고 있다. 김영 기자",https://www.cctoday.co.kr/news/articleView.html?idxno=2225350,https://cdn.cctoday.co.kr/news/thumbnail/202602/2225350_678363_3003_v150.jpg
2026-02-06,충청투데이,chungcheong,"대전교통공사, 도시철도 통신체계 고도화 나선다",분산운영 체계 통합 속도 및 안정성 보장,"[충청투데이 권오선 기자] 대전교통공사는 ‘대전철도 1호선 철도통합무선망(LTE-R) 구축사업 착수보고회’를 개최하고 도시철도 통신체계 고도화 사업을 본격 추진한다고 6일 밝혔다.이번 사업은 열차 운행, 관제, 유지보수, 비상 대응 등으로 분산운영되던 기존 통신체계를 국가 표준 철도통합 무선망(LTE-R)으로 통합 구축한다.LTE-R은 철도를 위한 무선통신망으로 열차와 관제센터, 역과 현장 직원들이 하나의 네트워크로 연결돼 상황을 신속·정확하게 공유할 수 있도록 돕는 시스템이다.특히 기존 통신 방식보다 속도와 안정성이 뛰어나 터널","분산운영 체계 통합 속도 및 안정성 보장 [충청투데이 권오선 기자] 대전교통공사는 ‘대전철도 1호선 철도통합무선망(LTE-R) 구축사업 착수보고회’를 개최하고 도시철도 통신체계 고도화 사업을 본격 추진한다고 6일 밝혔다. 이번 사업은 열차 운행, 관제, 유지보수, 비상 대응 등으로 분산운영되던 기존 통신체계를 국가 표준 철도통합 무선망(LTE-R)으로 통합 구축한다. LTE-R은 철도를 위한 무선통신망으로 열차와 관제센터, 역과 현장 직원들이 하나의 네트워크로 연결돼 상황을 신속·정확하게 공유할 수 있도록 돕는 시스템이다. 특히 기존 통신 방식보다 속도와 안정성이 뛰어나 터널 등 통신이 취약한 구간에서도 끊김 없는 환경이 구축된다. 또 실시간 CCTV 영상을 공유해 사고 상황을 즉시 파악하고 관계 기관과 협력 대응할 수 있다. 박필우 기술이사는 “철도통합문선망 구축은 도시 철도 운영 전반의 안전성과 대응 역량을 강화하는 핵심 인프라 사업”이라며 “안정적인 통신 환경을 통해 시민이 더욱 안심하고 이용할 수 있는 도시철도를 구현할 것”이라고 했다. 권오선 기자",https://www.cctoday.co.kr/news/articleView.html?idxno=2225343,https://cdn.cctoday.co.kr/news/thumbnail/202602/2225343_678355_0619_v150.jpg
2026-02-06,충청투데이,chungcheong,"동계훈련·전국대회 몰린 보령시, 상권도 들썩",보령시 웅천읍 상권 회복 시 스포츠도시 입증 강화,"[충청투데이 송인용 기자] 보령시 웅천읍이 올겨울 대규모 스포츠 전지훈련과 전국 축구대회 개최로 지역 전반에 활기가 돌고 있다. 보령스포츠파크와 웅천체육공원을 중심으로 선수단 방문이 집중되면서 동계 시즌 지역경제에 새로운 바람이 불고 있다는 평가다.올해 동계 시즌에는 프로축구단 U12 10개 팀 309명, 초등·클럽 유소년 축구팀 23개 팀 532명이 보령에서 훈련 일정을 소화했다. 여기에 ‘2026 만세보령머드 대한축구협회장배 전국 중등 축구대회’가 73개 팀 1,300명 규모로 열리며, 총 106개 팀 2,141명이 지역을 찾는","보령시 웅천읍 상권 회복 시 스포츠도시 입증 강화 [충청투데이 송인용 기자] 보령시 웅천읍이 올겨울 대규모 스포츠 전지훈련과 전국 축구대회 개최로 지역 전반에 활기가 돌고 있다. 보령스포츠파크와 웅천체육공원을 중심으로 선수단 방문이 집중되면서 동계 시즌 지역경제에 새로운 바람이 불고 있다는 평가다. 올해 동계 시즌에는 프로축구단 U12 10개 팀 309명, 초등·클럽 유소년 축구팀 23개 팀 532명이 보령에서 훈련 일정을 소화했다. 여기에 ‘2026 만세보령머드 대한축구협회장배 전국 중등 축구대회’가 73개 팀 1,300명 규모로 열리며, 총 106개 팀 2,141명이 지역을 찾는 등 보령이 대표적인 겨울 스포츠 도시로 입지를 공고히 하고 있다. 이 같은 대규모 선수단 방문은 숙소와 음식점을 중심으로 체류 소비가 증가하는 직접적인 효과를 가져오고 있다. 특히 웅천읍 일대는 전지훈련 기간 동안 평일·주말을 가리지 않고 방문객이 꾸준히 유입되며 상권 전반이 활성화되는 분위기다. 보령시는 이러한 흐름이 일시적인 성과에 그치지 않도록 연중 스포츠 행사를 지속적으로 확대하고 있다. 2월 20일부터 26일까지는 ‘2026 만세보령머드배 JS컵 한국유소년 축구대회’가 열릴 예정이며, 봄·가을에는 여성 풋살대회도 개최해 다양한 연령층이 참여하는 연중형 스포츠 이벤트를 계획하고 있다. 송인용 기자",https://www.cctoday.co.kr/news/articleView.html?idxno=2225341,https://cdn.cctoday.co.kr/news/thumbnail/202602/2225341_678356_755_v150.jpg
2026-02-06,충청투데이,chungcheong,"당진발전본부, 설맞이 ‘로컬푸드 직거래장터’ 개최",임직원 및 협력사 대상 70여 종 상품 판매… 지역 농가 소득 증대 기대,"[충청투데이 인택진 기자] 한국동서발전㈜ 당진발전본부는 5일 지역 농특산품 소비활성화를 위해 사옥 내에서 설맞이 ‘로컬푸드 직거래장터’를 열었다.이날 직거래 장터에는 19개 지역 농가가 참여해 해나루 사과, 배, 딸기, 표고버섯 등의 농산물과 해나루 약과, 아미주, 실치김, 황태된장 등 다채로운 지역특산품을 선보였으며, 당진발전본부와 협력업체 임직원들의 높은 호응 속에서 성황을 이뤘다.도순구 당진발전본부장은 “직거래장터는 임직원에게는 품질 좋은 먹거리를, 지역 농가에는 안정적인 판로를 제공하는 일석이조의 상생 모델”이라며, “앞으로","임직원 및 협력사 대상 70여 종 상품 판매… 지역 농가 소득 증대 기대 [충청투데이 인택진 기자] 한국동서발전㈜ 당진발전본부는 5일 지역 농특산품 소비활성화를 위해 사옥 내에서 설맞이 ‘로컬푸드 직거래장터’를 열었다. 이날 직거래 장터에는 19개 지역 농가가 참여해 해나루 사과, 배, 딸기, 표고버섯 등의 농산물과 해나루 약과, 아미주, 실치김, 황태된장 등 다채로운 지역특산품을 선보였으며, 당진발전본부와 협력업체 임직원들의 높은 호응 속에서 성황을 이뤘다. 도순구 당진발전본부장은 “직거래장터는 임직원에게는 품질 좋은 먹거리를, 지역 농가에는 안정적인 판로를 제공하는 일석이조의 상생 모델”이라며, “앞으로도 지역 농가의 실질적인 소득 증대를 위한 지원을 아끼지 않겠다”라고 강조했다. 장터에 참여한 한 직원은 “명절 선물을 고민하던 차에 신선한 지역 농산물을 합리적인 가격에 구매할 수 있어 만족스럽다”라고 소감을 전했다. 한편, 당진발전본부는 2014년부터 당진시 및 지역 농가와 손잡고 ‘로컬푸드 직거래 장터’ 행사를 이어오고 있으며 지난해 명절에는 총 3400만원의 높은 판매실적을 거두는 등 지역경제 활성화에 힘을 보태고 있다. 인택진 기자",https://www.cctoday.co.kr/news/articleView.html?idxno=2225340,https://cdn.cctoday.co.kr/news/thumbnail/202602/2225340_678352_0617_v150.jpg
2026-02-06,충청투데이,chungcheong,"KAIST, 오송에 K-바이오 핵심 거점 만들다",오송 KAIST 바이오 스퀘어 개소,"[충청투데이 김영재· 조정민 기자] 충북 오송 K-바이오 스퀘어 거점 역할을 할 KAIST 바이오 스퀘어가 6일 문을 열었다.이날 충북화장품임상연구지원센터에는 김영환 충북지사, 이광형 KAIST 총장, 이연희 국회의원, 김대수 KAIST 생명과학기술대학장, 김용진 서울대병원 연구부원장, 한상배 충북대 약학대학장, 이규선 한국생명공학연구원 연구전략본부장, 이명수 오송첨단의료산업진흥재단 이사장 등이 참석했다.충북도에 따르면 KAIST 바이오 스퀘어는 K-바이오 스퀘어 조성의 핵심 거점으로, 바이오 기술을 중심으로 AI(인공지능), 물리","오송 KAIST 바이오 스퀘어 개소 [충청투데이 김영재· 조정민 기자] 충북 오송 K-바이오 스퀘어 거점 역할을 할 KAIST 바이오 스퀘어가 6일 문을 열었다. 이날 충북화장품임상연구지원센터에는 김영환 충북지사, 이광형 KAIST 총장, 이연희 국회의원, 김대수 KAIST 생명과학기술대학장, 김용진 서울대병원 연구부원장, 한상배 충북대 약학대학장, 이규선 한국생명공학연구원 연구전략본부장, 이명수 오송첨단의료산업진흥재단 이사장 등이 참석했다. 충북도에 따르면 KAIST 바이오 스퀘어는 K-바이오 스퀘어 조성의 핵심 거점으로, 바이오 기술을 중심으로 AI(인공지능), 물리, 기계 등 다양한 학문의 경계를 허무는 융합 연구·교육 플랫폼이다. KAIST는 이곳을 전초기지로 삼아 서울대병원, 충북대, 충북대병원, 한국생명공학연구원, 오송첨단의료산업진흥재단 등과 협력체계를 구축하고, 파킨슨병 치료제 및 의료기기 개발을 포함한 노화 대응 R&D 분야에서 혁신 성과를 창출한다는 계획이다. 또 미래 바이오 산업 혁신을 이끌 창업기업을 유치하고 관련 산업 생태계를 발전시키는 한편, 연간 120개 벤처기업을 배출하는 KAIST의 창업 역량을 집적한 바이오 창업 전초기지로 육성할 방침이다. KAIST 바이오 스퀘어가 들어선 충북화장품임상연구지원센터는 2017년 4월 준공된 건물로 지하 1층과 지상 3층으로 구성돼 있다. 지상 1층은 KAIST 세미나실, 산·학·연·병 네트워킹 공간으로 우선 활용된다. 오는 6월부터 건물 전체 리모델링을 통해 강의실, 교수연구실, 대학원 학과사무실, 오픈랩(Lab), 공유 주방 등이 조성된다. 김영환 지사는 “K-바이오 스퀘어는 KAIST 오송 바이오메디컬 캠퍼스타운과 서울대병원 R&D 임상병원, 한국생명공학연구원과 오송첨단의료산업진흥재단이 함께 참여하는 R&D 등 총 3개의 큰 축으로 구성되어 있는데, KAIST 바이오 스퀘어는 이를 실현하기 위한 전초기지가 될 것”이라며 “큰 결단을 해준 KAIST 이광형 총장과 김대수 생명과학기술대학장에게 감사드린다”고 전했다. 이광형 KAIST 총장은 “K-바이오 스퀘어는 국가 바이오 전략과 중장기 국정과제의 일환으로 추진되고 있는 중요한 사업”이라며 “KAIST의 역량을 총결집해 오송 바이오메디컬 캠퍼스타운이 조기에 안착할 수 있도록 적극 추진하겠다”고 밝혔다. 김영재·조정민 기자",https://www.cctoday.co.kr/news/articleView.html?idxno=2225337,https://cdn.cctoday.co.kr/news/thumbnail/202602/2225337_678350_4911_v150.jpg
2026-02-06,충청투데이,chungcheong,"달라진 명절 문화에 ‘명절 특수’도 옛말 [설 명절, 커지는 부담]","[설 명절, 커지는 부담] 전통시장 방문객 평시 수준 그쳐 온라인 구매 등 소비 분산 영향 ""단기 대책·내수 회복 한계"" 제언","[충청투데이 김세영 기자] 경기 불황에 소비자의 차례 간소화 기조가 겹치면서 지역 유통업계에서는 명절 특수가 사라지고 있다는 목소리가 나온다.이에 정부가 비축 물량 공급 등 설 민생안정 대책을 추진하고 있지만, 지역 소규모 점포는 소외되는 등 효과가 제한적이라 정책 개선 및 보완 필요성이 떠오른다.5일 지역 시장상인회 등에 따르면 설 연휴를 일주일가량 앞둔 현장 분위기는 대목보다 평시에 가깝다.지역 전통시장에서 정육점을 운영 중인 A 씨는 ""손님들이 오긴 하는데, 가격을 물어보고 발길을 돌려 실제 구매로 이어지지 않고 있다""며 ""예","[설 명절, 커지는 부담] 전통시장 방문객 평시 수준 그쳐 온라인 구매 등 소비 분산 영향 ""단기 대책·내수 회복 한계"" 제언 [충청투데이 김세영 기자] 경기 불황에 소비자의 차례 간소화 기조가 겹치면서 지역 유통업계에서는 명절 특수가 사라지고 있다는 목소리가 나온다. 이에 정부가 비축 물량 공급 등 설 민생안정 대책을 추진하고 있지만, 지역 소규모 점포는 소외되는 등 효과가 제한적이라 정책 개선 및 보완 필요성이 떠오른다. 5일 지역 시장상인회 등에 따르면 설 연휴를 일주일가량 앞둔 현장 분위기는 대목보다 평시에 가깝다. 지역 전통시장에서 정육점을 운영 중인 A 씨는 ""손님들이 오긴 하는데, 가격을 물어보고 발길을 돌려 실제 구매로 이어지지 않고 있다""며 ""예년 같은 분위기는 진작에 포기했다""고 말했다. 이처럼 소비자들의 발길이 지역 오프라인 시장까지 닿지 않는 배경으로는 소비 패턴 변화가 꼽힌다. 과거와 달리 소비자들이 차례를 간소화하면서 대량 구매에 나서는 경우가 줄었고, 대형 온라인 플랫폼 확산으로 소비는 분산되고 있다. 실질적인 체감 소비 지표인 소매판매액도 2022년까지 4년 연속 감소세를 보이는 등 고물가로 소비 심리가 위축된 상태다. 이에 정부는 성수품 27만t을 공급하고, 전통시장 온누리상품권 환급 행사 규모를 270억 원에서 330억 원으로 확대하는 등 내수 활력을 위한 지원에 나섰다. 그러나 정부의 기대와 달리 성수품 비축 물량은 지역까지 내려오지 않고 있다. 비축 물량을 신청하려면 t당 소비 기준을 넘겨야 하는데, 지역 전통시장 점포는 규모가 작아 조건을 충족하지 못한다. 이용수 태평시장상인회장은 ""정부가 비축 물량을 풀었다고 하는데 시장 규모가 크지 않다 보니 수산물의 경우 11개 점포 중 1곳만 혜택을 받고 있다""며 ""정부가 소매시장에도 저렴하게 비축 물량을 많이 풀어줘야 체감이 될 것 같다""고 아쉬움을 토로했다. 온누리상품권의 경우 행사 기간 손님을 반짝 끌어모으는 효과는 있지만, 환급 품목이 국산으로 한정된 데다 좁은 골목에 몰린 소비자를 관리할 인력이 마땅치 않다는 부작용이 존재한다. 곽계윤 문창시장상인회장은 ""온누리상품권은 많은 상인이 좋아하는 정책이다. 행사 당일 오픈런 하는 손님이 있을 정도로 관심이 많은데 품목이 국산 농축수산물에 한정돼 있다 보니 내부적으로 아쉽다는 반응이 나온다""며 ""그나마 대전은 시 예산을 들여 환급 품목을 가공식품까지 늘려줬는데, 올해 첫 확대라 일회성으로 그칠까 걱정""이라고 말했다. 이에 대해 전문가는 명절 소비를 단기 부양책으로 되살리기에는 구조적 한계가 뚜렷하다고 진단한다. 소비 관습이 바뀐 상황에서 일시적인 환급이나 비축 물량 방출만으로는 내수 회복으로 이어지기 어렵다는 것이다. 정세은 충남대학교 경제학과 교수는 ""차례를 지내지 않거나 간소화하는 가구가 늘어난 상황에서 예전처럼 명절 특수를 기대하는 것은 현실적으로 어렵다""며 ""온누리상품권 환급이나 비축 물량 방출은 일부 시장에서 단기 효과는 있겠지만, 전체 내수를 움직일 만큼의 힘을 갖기는 제한적""이라고 설명했다. 이어 ""정책을 유지하더라도 소규모 점포까지 혜택을 받을 수 있게 기준을 완화하고 접근성을 강화해야 한다""며 ""변화한 소비 구조를 전제로 한 정책 방향 전환도 필요하다""고 덧붙였다. 김세영 기자",https://www.cctoday.co.kr/news/articleView.html?idxno=2225328,https://cdn.cctoday.co.kr/news/thumbnail/202602/2225328_678330_31_v150.jpg
