date,press,region,title,sub_title,description,content,article_url,image_url
2026-02-10,한국경제,national,'관세 25% 인상' 급한 불 껐지만…'비관세 장벽'은 변수,,한국산 제품 관세를 15%에서 25%로 재인상하겠다는 미국 정부의 압박이 소강 상태에 접어드는 모양새다. 국회가 대미투자특별법 처리를 위한 특별위원회 구성에 전격 합의하자 백악관이 ‘긍정적 진전’이라고 화답하면서다. 다만 비관세 장벽 문제가 변수로...,"한국산 제품 관세를 15%에서 25%로 재인상하겠다는 미국 정부의 압박이 소강 상태에 접어드는 모양새다. 국회가 대미투자특별법 처리를 위한 특별위원회 구성에 전격 합의하자 백악관이 ‘긍정적 진전’이라고 화답하면서다. 다만 비관세 장벽 문제가 변수로 남아 있다는 관측도 나온다. 도널드 트럼프 행정부 내에서 쿠팡 사태 해결 방식과 농산물 검역 문제, 온라인플랫폼법 입법 등 다양한 불만이 나오고 있어서다. ◇美 ‘합의 깨기’ 부담 느꼈나 10일 관련 부처에 따르면 미국의 품목관세 및 상호관세 25% 재인상 압박이 다소 누그러지는 분위기다. 한국 정부와 의회가 대미 투자를 지연하고 있다는 오해를 불식하기 위한 정부의 전방위 노력이 먹히고 있다는 뜻이다. 무엇보다 국회가 전날 여야 합의로 ‘대미투자특별법 처리를 위한 특별위원회 구성의 건’을 통과시킨 점이 결정적이었다. 김정관 산업통상부 장관은 전날 기자간담회에서 “해당 이슈(대미투자특별법 입법)가 해소되면서 관세 인상이 유예될 가능성이 높다고 생각한다”고 했다. 김 장관과 여한구 통상교섭본부장이 미국을 방문해 ‘1호 대미 투자’를 위한 구체적 협의를 시작한 것도 효과를 발휘했다는 분석이 나온다. 구윤철 부총리 겸 재정경제부 장관도 힘을 보탰다. 구 부총리는 이날 대외경제장관회의를 주재한 자리에서 대미투자특별법 처리 전에라도 투자 후보 프로젝트를 미리 검토하는 추진체계를 가동하겠다고 밝혔다. 특별법이 제정돼도 시행하는 데 시간이 걸리는 만큼 대미 투자 이행 속도가 늦다는 미국 측의 불필요한 오해를 피하겠다는 취지다. 구 부총리는 특별법 처리를 위한 국회 특위 구성을 환영하면서 “정부도 신속한 법안 처리를 위해 법안 심사 과정에서 최선을 다해 협조하겠다”고 말했다. 입법과 투자 실행에 속도를 내는 모습을 보여 미국 측의 압박을 최대한 누그러뜨린다는 취지다. ◇관세 이후 비관세가 ‘암초’되나 관세 재인상 압박의 완전 철회에 비관세 문제가 걸림돌이 될 수 있다는 우려도 나온다. 조현 외교부 장관은 전날 국회 대정부 질문에서 제이미슨 그리어 미국무역대표부(USTR) 대표와의 면담 결과를 설명하면서 “미국이 한국과의 비관세 장벽 관련 협상에서 진척이 없을 경우 관세를 인상하려 한다”고 밝혔다. 이런 가운데 릭 스위처 USTR 부대표가 한국을 방문해 11일 여 본부장과 만나기로 해 회의 결과에 관심이 쏠린다. 여 본부장은 앞선 방미 기간 그리어 대표와 면담을 추진했으나 불발됐다. 이에 대해 ‘한국 길들이기’라는 분석이 많았다. 이후 이번 답방 형태의 면담은 한·미 정상회담 ‘조인트 팩트시트’(공동설명자료)에 명시된 비관세 분야 합의에 대한 한국의 ‘이행 성적표’를 꼼꼼하게 따지는 까다로운 면담이 될 가능성이 높다. 구체적으로 원예작물 창구인 US데스크 설치 이후 상황, 온라인플랫폼법 입법 문제 등이 도마 위에 오를 것으로 보인다. 한 통상 전문가는 “문제는 여 본부장이 위임받은 협상 카드가 부족하다는 점”이라며 “농산물 문제는 우리 정부의 ‘레드라인’을 넘어설 수 있고, 온플법과 플랫폼 문제는 산업부가 혼자 결정할 수 있는 문제가 아니다”고 지적했다. 한편 김정관 장관은 이날 대정부질문에서 비관세 장벽과 관련해 “문제를 해결하려고 하는 노력이 많이 있다고 알고 있다”고 답했다. 이어 “물론 비관세 장벽과 관련해 한·미 간 여러 이슈가 있기는 하지만 그것은 그 트랙을 통해 관리 가능하다고 생각하고 있다”고 덧붙였다. 비관세 장벽 문제는 관세 재인상과는 별도의 이슈라는 취지로 해석됐다. 김대훈",https://www.hankyung.com/article/2026021072391,https://img.hankyung.com/photo/202602/AA.43246378.3.jpg
2026-02-10,한국경제,national,"李 ""문제 있다""…아파트 등록임대주택 양도세 중과 부활 예고",,"이재명 대통령이 등록임대사업자의 양도소득세 중과 배제를 문제 삼자 재정경제부가 관련 세제 혜택의 적정성 검토에 들어갔다. 시장에서는 단계적으로, 아파트에 한정해 등록임대주택에도 양도세 중과를 다시 적용하는 방안이 현실적이라는 관측이 나온다.10일 관계부처에 따르면 재경부는 최근 등록임대주택에 부여된 세제 혜택 수준이 적정한지를 전반적으로 들여다보고 있다. ...","이재명 대통령이 등록임대사업자의 양도소득세 중과 배제를 문제 삼자 재정경제부가 관련 세제 혜택의 적정성 검토에 들어갔다. 시장에서는 단계적으로, 아파트에 한정해 등록임대주택에도 양도세 중과를 다시 적용하는 방안이 현실적이라는 관측이 나온다. 10일 관계부처에 따르면 재경부는 최근 등록임대주택에 부여된 세제 혜택 수준이 적정한지를 전반적으로 들여다보고 있다. 재경부 관계자는 “양도세 중과 면제도 주요 검토 대상”이라고 전했다. 이 대통령은 이날 국무회의에서 “의무임대 기간이 지나도 기한 없이 양도세 중과를 하지 않는 것은 문제가 있다”며 “적정한 기간이 지나면 일반 주택과 동일하게 중과해야 한다”고 밝혔다. 전날에는 X(옛 트위터)에 “등록임대주택에 대한 양도세 중과 제외 특혜는 즉시 폐기할 경우 부담이 큰 만큼, 일정 기간을 두고 단계적으로 축소하는 방안도 있고 적용 대상을 아파트로 한정하자는 의견도 있다”고 적었다. 시장에선 등록임대주택에 주는 세제 혜택을 한 번에 없애기는 쉽지 않다는 시각이 많다. 양도세 중과 배제 등을 전제로 임대사업자 등록에 나선 사례가 적지 않아서다. 문재인 정부는 2017년 임대료 인상률을 연 5%로 제한하는 대신 양도세 중과 배제와 종합부동산세·임대소득세 감면 등을 내걸고 민간 임대사업자 등록을 유도했다. 그 결과 민간 임대주택은 2017년 180만 가구에서 2019년 220만5000가구로 늘었다. 세제 혜택이 과도하다는 지적이 나오자 문재인 정부는 2020년 8월 단기(4년) 임대와 아파트 장기 일반(8년) 매입임대 유형을 폐지했다. 그러나 윤석열 정부에서 단기(6년) 등록임대제도를 다시 도입했다. 정책 일관성이 없어 시장 혼란이 커진다는 비판이 나오는 대목이다. 함영진 우리은행 부동산리서치랩장은 “서울의 경우 한강변이나 재개발 지역이 아니라면 비아파트 주택의 가격 변동성이 크지 않다”며 “이들 주택은 상대적으로 저렴한 임대차 물량을 공급하는 역할도 하는 만큼 양도세 중과 부활은 아파트 위주로 적용해야 충격을 줄일 수 있다”고 말했다. 이광식 기자",https://www.hankyung.com/article/2026021071971,
2026-02-10,한국경제,national,전기차 '충전기 심장' 국내서 만든다,,전력망과 긴밀히 연결되는 전기자동차 충전 인프라가 중국산에 잠식당하면서 전기화 시대 에너지 안보에 대한 우려가 크다. 이에 급속 충전기의 ‘심장’ 격인 파워모듈을 국내에서 생산하려는 움직임이 빨라지고 있다. 10일 기후에너지환경부와 관련 ...,"전력망과 긴밀히 연결되는 전기자동차 충전 인프라가 중국산에 잠식당하면서 전기화 시대 에너지 안보에 대한 우려가 크다. 이에 급속 충전기의 ‘심장’ 격인 파워모듈을 국내에서 생산하려는 움직임이 빨라지고 있다. 10일 기후에너지환경부와 관련 업계에 따르면 전기차 급속충전기용 파워모듈 시장은 중국산이 90%를 장악하고 있다. 중국 업체가 거대한 내수시장에서 쌓은 기술력과 가격 경쟁력을 앞세워 국내 시장을 완전히 선점했다는 평가가 나온다. 파워모듈은 급속충전기에서 교류(AC)를 직류(DC)로 바꾸는 핵심 부품으로, 충전 속도와 에너지 효율을 결정한다. 이에 국내 기업들이 반격에 나섰다. 2022년 국산화에 들어간 LG이노텍은 작년 말 광주 공장에 탄화규소(SiC·실리콘카바이드) 전력반도체를 적용한 파워모듈 생산 체계를 구축했다. 이 파워모듈을 롯데그룹 계열 전기차 충전회사인 이브이시스(EVSIS)가 납품받아 급속충전기를 제작했다. 조만간 기후부가 운영하는 공공 전기차 충전소에 설치될 예정인 것으로 알려졌다. 이 밖에 솔루엠-현대케피코 컨소시엄 등 세 곳이 국산 파워모듈을 적용한 충전기 개발에 나선다. 김리안 기자",https://www.hankyung.com/article/2026021072541,https://img.hankyung.com/photo/202602/AA.43247837.3.jpg
2026-02-10,한국경제,national,반도체 슈퍼호황에 세수 1.8조 더 걷혀,,반도체 슈퍼호황으로 지난해 국세 수입이 정부 추산치(추가경정예산 기준)보다 1조8000억원 더 걷혔다. 올해도 법인세가 큰 폭으로 늘고 있어 ‘초과 세수’가 예상된다.재정경제부가 10일 발표한 ‘2025회계연도 총세입·총세출 마감 결과’ 등에 따르면 지난해 국세 수입은 373조9000억원으로 전년보다 ...,반도체 슈퍼호황으로 지난해 국세 수입이 정부 추산치(추가경정예산 기준)보다 1조8000억원 더 걷혔다. 올해도 법인세가 큰 폭으로 늘고 있어 ‘초과 세수’가 예상된다. 재정경제부가 10일 발표한 ‘2025회계연도 총세입·총세출 마감 결과’ 등에 따르면 지난해 국세 수입은 373조9000억원으로 전년보다 37조4000억원 늘었다. 법인세 세수가 큰 폭으로 증가한 영향인 것으로 분석됐다. 전년도 기업 실적을 기준으로 징수하는 법인세는 지난해 84조6000억원으로 1년 전보다 22조1000억원(35.3%) 증가했다. 유가증권시장 상장사의 2024년 영업이익(별도 기준)이 106조2000억원으로 전년보다 67조5000억원(174.4%) 늘어난 것이 반영됐다. 소득세는 130조5000억원으로 13조원(11.1%) 늘었다. 지난해 근로자가 1663만6000명으로 전년보다 1.7% 증가한 영향 등이 작용했다. 상속·증여세도 16조5000억원으로 전년보다 1조2000억원(7.7%) 늘었다. 2024년 사망자가 35만8600명으로 6100명(1.7%) 많아진 영향이다. 종합부동산세는 4조7000억원으로 5000억원(11.2%) 불어났다. 지난해 국세 수입은 작년 6월 추가경정예산 기준으로 산출한 세수(372조1000억원)보다 1조8000억원 많은 규모다. 2025년 본예산 당시 산출한 세수(382조4000억원)와 비교하면 8조5000억원 덜 걷혔다. 재경부 관계자는 “지난해 세입 경정을 통해 국회의 공식 승인을 받아 세입·세출을 조정했다”며 “이 기준을 바탕으로 올해 세수 결손 여부 등을 평가해야 한다”고 말했다. 올해 세수도 당초 예상보다 큰 폭으로 늘어날 것으로 관측된다. 삼성전자와 SK하이닉스 등 주요 반도체 기업이 지난해 역대 최대 실적을 거둔 영향 등으로 법인세 세수가 급증할 가능성이 높아서다. 정부가 지난해 국회에 제출한 2026년 예산안에 따르면 올해 법인세 수입은 86조5000억원으로 지난해보다 2조원가량 증가한다. 김익환,https://www.hankyung.com/article/2026021072401,
2026-02-10,한국경제,national,"국민연금, 주총 입김 세진다",,국민연금이 다음달 정기주주총회부터 의결권을 행사하는 기준을 기존 ‘지분율 10% 이상’에서 ‘지분율 5% 이상’으로 확대한다. 중점 관리 기업 여부를 판단하는 기준은 배당성향에서 자기주식 소각 규모를 포함한 총주주환원율로 강화한다.보건복지부는 10일 이 같은 내용을 담은 국민연금 수탁자 책임활동 강화 방안을 발표했...,"국민연금이 다음달 정기주주총회부터 의결권을 행사하는 기준을 기존 ‘지분율 10% 이상’에서 ‘지분율 5% 이상’으로 확대한다. 중점 관리 기업 여부를 판단하는 기준은 배당성향에서 자기주식 소각 규모를 포함한 총주주환원율로 강화한다. 보건복지부는 10일 이 같은 내용을 담은 국민연금 수탁자 책임활동 강화 방안을 발표했다. 이에 따르면 오는 3월 정기주총부터 국민연금 의결권 행사 사전 공개 대상을 기존 ‘지분율 10% 이상 또는 보유 비중 1% 이상 기업의 전체 안건’에서 ‘지분율 5% 이상 또는 보유 비중 1% 이상 기업의 전체 안건’으로 확대한다. 국민연금은 이번 조치로 의결권 행사 대상 기업이 기존 61개에서 265개로 네 배 이상 늘어날 것으로 보고 있다. 지난해 기준 사전 공개 대상 안건은 292건에서 1280건으로 증가한다. 복지부 관계자는 “국민연금 의결권 행사의 투명성을 강화하고, 주주로서 입장을 알려 장기적으로 주주가치를 높이기 위한 조치”라며 “반대 의결권 행사를 결정할 경우 반대 근거 등 세부 사유도 충실하게 공개하겠다”고 설명했다. 국민연금이 소위 ‘문제 기업’을 선정하는 기준도 강화된다. 그동안 비공개 대화 대상 기업은 현금배당을 당기순이익으로 나눈 배당성향을 기준으로 판단했다. 다음달부터는 현금배당과 자기주식 소각 규모를 당기순이익으로 나눈 총주주환원율로 기준을 바꾼다. 국민연금은 중점 관리 기업을 비공개 대화 대상 기업, 비공개 중점 관리 기업, 공개 중점 관리 기업 순으로 분류하고 있다. 국민연금 관계자는 “지금까지는 합리적인 배당정책을 수립하지 않은 기업만 1단계 비공개 대화 대상 기업으로 선정했지만 다음달부터는 자사주 소각 등 주주환원 노력이 부족한 기업도 비공개 대화 대상 기업에 포함될 것”이라고 했다. 최근 국민연금이 개인정보 유출 사태를 빚은 KT 를 비공개 대화 대상 기업으로 분류한 것도 주주권 강화의 일환으로 해석됐다. 이스란 복지부 1차관은 “이번 대책은 기금 수익 제고라는 원칙을 견지하면서 자산 가치를 보호하고 국민에게 신뢰받는 수탁자 책임 활동을 수행하기 위한 방안”이라고 말했다. 남정민 기자",https://www.hankyung.com/article/2026021071311,
2026-02-10,한국경제,national,중국은 이미 뛰고 있는데…'소유권 장벽'에 갇힌 韓 배터리,,"전기차 캐즘(일시적 수요 정체)으로 배터리 산업 전반도 직격탄을 맞고 있다. 완성차 판매 둔화가 배터리 출하 감소로 이어지는 구조에서, 단순 제조·판매 중심 구조를 넘어 ‘배터리 서비스(Baa...","전기차 캐즘(일시적 수요 정체)으로 배터리 산업 전반도 직격탄을 맞고 있다. 완성차 판매 둔화가 배터리 출하 감소로 이어지는 구조에서, 단순 제조·판매 중심 구조를 넘어 ‘배터리 서비스(BaaS·Battery as a Service)’ 같은 후방 생태계를 키워야 한다는 목소리가 커지고 있다. 10일 시장조사기관 포춘비즈니스인사이트에 따르면 글로벌 전기차 시장이 연평균 13% 성장하는 동안, BaaS 시장은 21%의 더 높은 성장률을 보일 것으로 전망됐다. 2023년 203억달러던 BaaS 시장이 2030년이면 5300억달러(약 773조원)까지 커질 것이란 분석이다. 이는 배터리를 제조·판매 재화가 아닌 금융·회수·재사용·재자원화 등 다양한 분야로 확장할 여지가 크다는 뜻이다. BaaS의 핵심은 배터리 소유권을 차량과 분리하는 것이다. 배터리를 제조사나 플랫폼 사업자가 소유하고, 소비자는 구독·리스 방식으로 이용하는 구조를 제도적으로 뒷받침하자는 취지다. 이를 통해 소비자는 전기차 원가의 절반 가까이를 차지하는 배터리 비용 부담을 덜 수 있다. 해외에선 배터리 소유권 분리를 전제로 한 서비스 실험이 빠르게 진행되고 있다. 특히 차량에 장착된 배터리를 다른 배터리로 바꿔 쓰는 배터리 교환(스와핑) 모델이 중국을 중심으로 확산되고 있다. 니오(NIO)는 차량과 배터리를 분리 판매하는 구독 모델과 함께 대규모 교환소 네트워크를 운영하고 있다. 세계 최대 배터리 제조사인 CATL은 자체 배터리 교환 브랜드 이보고(EVOGO)를 출범했다. 배터리 소유권 분리는 전기차 판매 이후의 후방시장(애프터마켓)을 여는 핵심 조건으로도 꼽힌다. 배터리 식별번호(ID)를 자동차 등록원부에 기재해 교체·운행 이력을 추적할 수 있게 되면, 배터리는 단순 부품이 아니라 생애주기 전반을 관리할 수 있는 자산이 된다. 이력 데이터가 배터리 잔존가치 평가와 중고 전기차 거래, 보험·금융 상품 설계의 기초 정보로 활용될 수 있을 뿐 아니라 사용 후 배터리 회수와 에너지저장장치(ESS) 등 재사용, 핵심광물 재자원화 사업 활성화의 기반이 된다는 의미다. 국내에서도 피엠그로우, 현대차그룹에서 분할 설립된 피트인 등 BaaS 기업들이 있다. 피트인은 배터리 교체·구독 인프라형 사업을, 피엠그로우는 배터리 팩 개발과 관리 시스템을 바탕으로 배터리 상태를 진단·평가하는 데이터 기반 사업을 전개하고 있다. 박재홍 피엠그로우 대표는 ""다만 현행 제도상 배터리 소유권이 차량 소유자에게 귀속돼 있어 차주 동의에 기반한 데이터 위탁·관리 방식으로 사업을 운영하고 있다""고 말했다. 전문가들은 이러한 서비스가 국내에서 본격 확산되기 위해서는 자동차관리법 개정을 통한 소유권 분리가 선행돼야 한다고 강조한다. 실제로 현대캐피탈은 미국에서는 배터리 구독 서비스 이볼브(Evolve+)를 운영하고 있지만, 국내에서 기아차와 추진하려던 구독 서비스 시범 사업이 법적 제약으로 인해 중단됐다. LG에너지솔루션도 최근 배터리 평가 서비스 비온스를 출시했지만 배터리 소유권과 이력 관리가 제도적으로 분리되지 않은 상황에서는 금융·유통·재사용 서비스로의 확장이 쉽지 않을 것이란 전망이 나온다. 김리안 기자",https://www.hankyung.com/article/202602106236i,https://img.hankyung.com/photo/202602/AA.27304609.3.jpg
2026-02-10,한국경제,national,"구윤철 ""대미투자법 시행 前에도 후보 프로젝트 미리 검토""",,"구윤철 부총리 겸 재정경제부 장관이 “한미 전략적 투자 관리를 위한 특별법이 시행되기 전까지 미국과 한국이 발굴한 후보 프로젝트에 대해 사전 검토하겠다”고 말했다. 법 통과부터 실제 시행까지 시간이 걸리는 만큼, 대미 투자 이행 ...","구윤철 부총리 겸 재정경제부 장관이 “한미 전략적 투자 관리를 위한 특별법이 시행되기 전까지 미국과 한국이 발굴한 후보 프로젝트에 대해 사전 검토하겠다”고 말했다. 법 통과부터 실제 시행까지 시간이 걸리는 만큼, 대미 투자 이행 속도가 늦다는 미국 측의 불필요한 오해를 피하기 위해서다. 구 부총리는 10일 정부서울청사에서 대외경제장관회의를 주재하고 ‘한미 전략적 투자 MOU 시행을 위한 임시 추진체계 구축방안’을 심의·의결했다. 전날 국회는 한미 전략적 투자 관리를 위한 특별법(이하 대미투자 특별법) 처리를 위한 특별위원회 구성안을 가결했다. 이날 구 부총리는 모두발언에서 “대미투자 특별법이 통과된다 하더라도, 하위법령 제정 등 준비를 거쳐 실제 시행까지 3개월 여의 시간이 추가 소요된다”며 “MOU 합의 이행과정에서 한미간 불필요한 오해가 발생하거나 신뢰가 훼손되는 것은 국익 관점에서 바람직하지 않다”고 말했다. 이어 “대미투자 특별법상 운영위원회를 대신해 대외경제장관회의가 임시 컨트롤타워를 담당한다”며 “산업부 장관과 관계부처 차관 및 관계기관 등이 참여하는 ‘전략적 투자 MOU 이행위원회’를 한시적으로 운영하겠다”고 설명했다. 전략적 투자 MOU 이행위원회 밑에는 ‘사업예비검토단’을 꾸리고 미국과 한국이 발굴한 프로젝트 후보에 대해 상업적 합리성 등을 검토할 예정이다. 구 부총리는 “한미간 합의 이행을 위한 정부와 국회의 노력을 미국에 충분히 설명하겠다”며 “한국 경제와 기업이 글로벌 밸류체인을 선점하는 기회가 될 수 있도록 준비하겠다”고 모두발언을 마무리 지었다. 남정민 기자",https://www.hankyung.com/article/202602106029i,https://img.hankyung.com/photo/202602/01.43241255.3.jpg
