date,press,region,title,sub_title,description,content,article_url,image_url
2026-02-12,충청투데이,chungcheong,‘코레일톡’ 설·새학기 할인·경품 이벤트,오는 13일~내달 31일 행사 진행 렌터카·카셰어링·관광택시 등 대상 포인트·무료 이용권·커피 쿠폰도,"[충청투데이 이석준 기자] 한국철도공사(코레일)가 설 명절과 새 학기를 맞아 13일부터 내달 31일까지 코레일 MaaS(Mobility as a Service) 고객을 대상으로 할인과 경품 이벤트를 진행한다고 12일 밝혔다.코레일 MaaS는 모바일 앱 코레일톡을 기반으로 승차권 예매뿐만 아니라 렌터카, 카셰어링, 커피&빵 등 교통과 여행 서비스를 함께 제공하는 통합 모빌리티 서비스다.먼저, 코레일톡에서 롯데렌터카와 SK렌터카를 이용하면 대여료를 최대 75%까지 즉시 할인한다.역 인근의 공유 차량을 빌릴 수 있는 카셰어링도 이용객에","오는 13일~내달 31일 행사 진행 렌터카·카셰어링·관광택시 등 대상 포인트·무료 이용권·커피 쿠폰도 [충청투데이 이석준 기자] 한국철도공사(코레일)가 설 명절과 새 학기를 맞아 13일부터 내달 31일까지 코레일 MaaS(Mobility as a Service) 고객을 대상으로 할인과 경품 이벤트를 진행한다고 12일 밝혔다. 코레일 MaaS는 모바일 앱 코레일톡을 기반으로 승차권 예매뿐만 아니라 렌터카, 카셰어링, 커피&빵 등 교통과 여행 서비스를 함께 제공하는 통합 모빌리티 서비스다. 먼저, 코레일톡에서 롯데렌터카와 SK렌터카를 이용하면 대여료를 최대 75%까지 즉시 할인한다. 역 인근의 공유 차량을 빌릴 수 있는 카셰어링도 이용객에 최대 60% 할인과 커피 쿠폰을 제공한다. 또 추첨을 통해 카셰어링 이용객 13명에게는 G포인트 3만 포인트(10명), 카셰어링 24시간 무료 이용권(3명)을 증정한다. 영주, 평창, 홍성 등 23개 지역을 여행할 수 있는 관광택시는 지자체에서 요금을 최대 60% 할인하고, 제휴 업체 로이쿠에서 커피 쿠폰 2매를 증정한다. 이민성 코레일 고객마케팅단장은 “설 명절과 새 학기를 맞아 코레일톡에서 풍성한 할인 이벤트를 준비했으니 많은 이용 부탁드린다”고 말했다. 이석준 기자",https://www.cctoday.co.kr/news/articleView.html?idxno=2225671,https://cdn.cctoday.co.kr/news/thumbnail/202602/2225671_678820_1503_v150.jpg
2026-02-12,충청투데이,chungcheong,국가기술 해외 유출될 뻔… 대기업 직원과 내통 외국인 구속기소,국내 이차전지 대기업 직원에 금품 대가로 기술 정보 200여장 유출한 외국인 구속기소 내통한 직원은 '꿈의 배태러' 전고체전지 기술도 빼돌려…다행히 해외까진 안 넘어가,"[충청투데이 김중곤 기자] 국내 이차전지 대기업 임직원과 내통해 내부 기술정보를 해외로 탈취한 외국인이 재판에 넘겨졌다.그와 내통한 피해기업 직원은 꿈의 배터리로 불리는 ‘전고체전지’ 관련 국가첨단전략기술도 회사에서 빼돌린 상태였는데, 다행히 해외까지 유출되진 않은 것으로 조사됐다.12일 지식재산처에 따르면 피해기업의 해외협력사 영업총괄 A(34)씨가 국가첨단전략산업법과 부정경쟁방지법 위반 혐의로 구속 기소됐다.완성 이차전지 업체에 음극재 원료를 제조·판매하는 업체에 재직하던 A씨는 2019년 11월~2025년 4월 피해기업의 부장","국내 이차전지 대기업 직원에 금품 대가로 기술 정보 200여장 유출한 외국인 구속기소 내통한 직원은 '꿈의 배태러' 전고체전지 기술도 빼돌려…다행히 해외까진 안 넘어가 [충청투데이 김중곤 기자] 국내 이차전지 대기업 임직원과 내통해 내부 기술정보를 해외로 탈취한 외국인이 재판에 넘겨졌다. 그와 내통한 피해기업 직원은 꿈의 배터리로 불리는 ‘전고체전지’ 관련 국가첨단전략기술도 회사에서 빼돌린 상태였는데, 다행히 해외까지 유출되진 않은 것으로 조사됐다. 12일 지식재산처에 따르면 피해기업의 해외협력사 영업총괄 A(34)씨가 국가첨단전략산업법과 부정경쟁방지법 위반 혐의로 구속 기소됐다. 완성 이차전지 업체에 음극재 원료를 제조·판매하는 업체에 재직하던 A씨는 2019년 11월~2025년 4월 피해기업의 부장급 연구원 B(53)씨로부터 금품을 대가로 200여 장에 달하는 내부 정보를 빼돌린 혐의를 받는다. B씨가 회사에서 탈취한 이차전지 소지개발업무와 관련 자료 등은 9000여 장에 달한 것으로 전해진다. 특히 이중에는 국가산업경쟁력에 직접적인 영향을 미치는 전고체전지 관련 국가첨단전략기술도 포함돼 있었다. 전고체전지는 화재안전성과 높은 에너지 밀도, 급속충전이 가능해 상용화만 되면 시장이 판도를 바꿀 게임체인저로 평가된다. 또 소재 개발과 관련한 협력사별 동향, 피해회사의 중장기 개발 로드맵, 이차전지 제조공정 기술 등의 정보도 유출됐던 것으로 조사됐다. B씨는 지난해 8월 숨지면서 기소되지 않았다. 지재처는 2025년 3월 이번 사건을 인지하고, 국가정보원과 피해회사의 신속한 대응으로 B씨를 특정했으며, 그 다음달 그의 근무지와 주거지를 동시에 압수수색해 사진파일 등 관련 증거를 확보했다. 이후 증거분석을 통해 B씨가 해외소재업체와 접촉한 사실, A씨가 소속된 해외협력사에 자료를 전달한 사실 등을 파악하고, 그해 8월 A씨가 입국하는 순간 압수수색영장을 집행하고 조사를 실시했다. 그 결과 이차전지분야 기술유출사건에서 외국인을 최초로 구속하고, 전고체전지의 핵심정보가 해외로 유출되는 최악의 사태를 막을 수 있었다고 지재처는 강조했다. 김용선 지식재산처장은 “이번 수사는 대한민국 이차전지 산업의 미래가 걸린전고체전지핵심기술을 지켜냈다는 데 큰 의의가 있다”며 “기술경찰 수사인력을 대폭 확대해 기술유출범죄를 뿌리 뽑고, 단호히 대응하겠다”고 말했다. 김중곤 기자",https://www.cctoday.co.kr/news/articleView.html?idxno=2225662,https://cdn.cctoday.co.kr/news/thumbnail/202602/2225662_678812_4309_v150.jpg
2026-02-12,충청투데이,chungcheong,"옥천로컬푸드직매장, 지난해 매출 73억…충북 1위",2019년 개장 이후 최대 실적…경쟁력·자립 기반 입증,"[충청투데이 박병훈 기자] 옥천군은 옥천로컬푸드직매장이 2025년 매출액이 73억원을 달성하며 충청북도 10개 시군, 46개소 로컬푸드직매장 중 매출 1위를 기록했다고 12일 밝혔다.이는 2019년 개장 이후 최대 실적으로 공공형 로컬푸드 직매장의 경쟁력과 자립 기반을 입증한 의미 있는 성과로 평가된다.옥천로컬푸드직매장은 현재 517명의 출하 농가에서 579여 종의 농축산물과 가공식품을 납품하고 있으며 3만 2000여 명의 소비자들이 이용 중이다.그동안 누적 매출액 360억원, 누적 방문객 수 127만명을 기록했으며 농림축산식품부로","2019년 개장 이후 최대 실적…경쟁력·자립 기반 입증 [충청투데이 박병훈 기자] 옥천군은 옥천로컬푸드직매장이 2025년 매출액이 73억원을 달성하며 충청북도 10개 시군, 46개소 로컬푸드직매장 중 매출 1위를 기록했다고 12일 밝혔다. 이는 2019년 개장 이후 최대 실적으로 공공형 로컬푸드 직매장의 경쟁력과 자립 기반을 입증한 의미 있는 성과로 평가된다. 옥천로컬푸드직매장은 현재 517명의 출하 농가에서 579여 종의 농축산물과 가공식품을 납품하고 있으며 3만 2000여 명의 소비자들이 이용 중이다. 그동안 누적 매출액 360억원, 누적 방문객 수 127만명을 기록했으며 농림축산식품부로부터 우수 농산물 직거래사업장인증을 받아 지역 농업인의 안정적인 소득 기반을 뒷받침하고 있다. 이번 성과는 체계적인 생산자 교육 강화, 정기·수시 잔류농약 등 철저한 품질 및 안전성 관리, 요리교실 및 소비자 모니터링단 운영, 농축산물 할인지원 사업 등 방문객 혜택 제공, 지역화폐 가맹점 중 결제금액 1위 달성, 운영수익금의 지역 환원을 통한 상생 구조 강화 등 내실 있는 운영이 복합적으로 작용한 결과로 분석된다. 군 관계자는 “이번 매출 1위 달성은 지역화폐 인센티브 정책과 안전하고 신선한 지역 농산물에 대한 소비자 신뢰가 결합된 결과”라며 “앞으로도 출하 농가에는 안정적인 판로를 제공하고 소비자 만족도를 높이는 정책을 통해 지역 먹거리 선순환 구조를 더욱 공고히 하겠다”고 말했다. 박병훈 기자",https://www.cctoday.co.kr/news/articleView.html?idxno=2225649,https://cdn.cctoday.co.kr/news/thumbnail/202602/2225649_678795_4047_v150.jpg
2026-02-12,충청투데이,chungcheong,"음성비석새마을금고, 56년 연속 흑자 쾌거",올해 순이익 1억 6900여 만 원 달성…3.5% 출자 배당 장학금 지원·이웃돕기·경로당 유류지원 등 나눔 실천,"[충청투데이 김영 기자] 음성군 비석새마을 금고가 지난해 당기순이익 1억 6900여 만 원을 달성하며 1969년 창립 이후 56년 연속 흑자라는 도내 최고의 업적을 이어가고 있어 눈길을 끌고 있다.음성비석새마을금고(이하 금고)은 2025년도 당기순이익 1억 6900여 만 원을 달성해 3.5%의 출자배당을 진행한다고 12일 밝혔다.금고는 지난 7일 음성고등학교 체육관에서 1100여 명의 회원이 참석한 가운데 제71차 정기총회를 성황리에 개최했다.이날 총회에서는 2025년 결산(안) 및 2026년 사업계획 및 예산계획(안)을 승인하고,","올해 순이익 1억 6900여 만 원 달성…3.5% 출자 배당 장학금 지원·이웃돕기·경로당 유류지원 등 나눔 실천 [충청투데이 김영 기자] 음성군 비석새마을 금고가 지난해 당기순이익 1억 6900여 만 원을 달성하며 1969년 창립 이후 56년 연속 흑자라는 도내 최고의 업적을 이어가고 있어 눈길을 끌고 있다. 음성비석새마을금고(이하 금고)은 2025년도 당기순이익 1억 6900여 만 원을 달성해 3.5%의 출자배당을 진행한다고 12일 밝혔다. 금고는 지난 7일 음성고등학교 체육관에서 1100여 명의 회원이 참석한 가운데 제71차 정기총회를 성황리에 개최했다. 이날 총회에서는 2025년 결산(안) 및 2026년 사업계획 및 예산계획(안)을 승인하고, 정관 일부 개정안 의결, 회원 제명, 임원 선출 등 주요 안건 등을 다루었다. 금고는 지난해 국내·외적인 경제불황과 고환율, 고물가 등 금융환경이 열악한 상황에서도 임직원의 임심동체로 금고 성장을 위해 혼신의 노력을 기울였다. 아울러 8700여 명이 넘는 금고 회원들이 애정으로 힘을 보태면서 자산이 2024년 말 1735억에서 120여 억원(7%)이 증가해 1855억 원으로 성장했다. 그러면서 금고는 세후 당기 순이익 1억 6900여 만 원이 발생되어 1969년 창립 이후 56년 연속 흑자라는 도내 최고의 업적을 달성했다. 이에 금고는 3.5%의 출자배당을 진행한다. 이와 함께 비석새마을금고는 충북도내 53개 새마을금고 가운데 금고지역본부 종합프로모션(생명공제, 손해공제, 신용카드)에서 1등을 차지하며 두각을 보였다. 금고는 성장과 더불어 장학금 지원, 불우이웃돕기, 자매결연 학생 후원, 경로당 유류지원 등 사회공헌 활동을 지속적으로 펼쳤다. 또한 회원들의 행복과 건강한 여가 선용을 위해 산악회, 추억의 기차여행 등을 운영해 주민들로부터 큰 호응을 얻고 있다. 박광서 이사장은 “회원들의 신뢰와 성원으로 안정적인 경영속에 성장을 이어가고 있다”며 “앞으로도 회원 가족들이 최우선이라는 경영 목표로 회원들에게 기쁨과 행복, 그리고 희망, 즐거움을 주는 최고의 금고가 되도록 임직원 모두가 최선을 다하겠다”고 밝혔다. 김영 기자",https://www.cctoday.co.kr/news/articleView.html?idxno=2225645,https://cdn.cctoday.co.kr/news/thumbnail/202602/2225645_678791_1502_v150.jpg
2026-02-12,충청투데이,chungcheong,대덕 아이디어+오송 인프라 ‘시너지 가능성’ [K-바이오의 심장 충청 리포트],"[K-바이오의 심장 충청권 리포트] 오름테라퓨틱, 세계시장검증절차 통과 연구 설계단계부터 설비·환경방향 고려","[충청투데이 조정민 기자] #. 대전 유성구에 위치한 오름테라퓨틱은 대전 바이오 산업의 현재를 보여주는 대표 기업이다. 신약 개발 초기 단계에서 치료 표적을 정밀하게 설정하고, 실제 약으로 이어질 가능성이 높은 설계를 만들어내는 데 주력하고 있다. 개발 단계부터 글로벌 제약사가 요구하는 기준을 염두에 두고 기술을 고도화해온 점이 특징이다. 완제품 생산에 앞서 연구 단계 기술로 글로벌 제약사와 기술 계약을 체결하며 대전의 연구 역량이 세계 시장과 직접 연결될 수 있음을 보여주고 있다.대전 바이오 기업들이 연구 성과 축적 단계를 넘어","[K-바이오의 심장 충청권 리포트] 오름테라퓨틱, 세계시장검증절차 통과 연구 설계단계부터 설비·환경방향 고려 [충청투데이 조정민 기자]  대전 유성구에 위치한 오름테라퓨틱은 대전 바이오 산업의 현재를 보여주는 대표 기업이다. 신약 개발 초기 단계에서 치료 표적을 정밀하게 설정하고, 실제 약으로 이어질 가능성이 높은 설계를 만들어내는 데 주력하고 있다. 개발 단계부터 글로벌 제약사가 요구하는 기준을 염두에 두고 기술을 고도화해온 점이 특징이다. 완제품 생산에 앞서 연구 단계 기술로 글로벌 제약사와 기술 계약을 체결하며 대전의 연구 역량이 세계 시장과 직접 연결될 수 있음을 보여주고 있다. 대전 바이오 기업들이 연구 성과 축적 단계를 넘어 시장과의 연결 가능성을 실제로 시험하는 국면에 들어선 분위기다. 연구 결과가 논문이나 단순 기술 이전에 머무르지 않고 글로벌 제약사 등에서 개발을 이어갈 수 있는 수준까지 검증되고 있다는 분석이다. 11일 방문한 오름테라퓨틱은 대전 바이오 기업들이 도달한 현 시점을 보여주는 사례로 꼽힌다. 연구 단계 기술을 기반으로 글로벌 제약사와 기술 계약을 체결하며 대전 연구실에서 설계된 플랫폼이 세계 시장 검증 절차를 통과했다. 대전 연구 환경이 산업과 맞닿는 지점이 점차 구체화되고 있다는 평가가 나오는 이유다. 수출 방식에서도 변화가 감지된다. 완성된 의약품을 해외로 내보내는 전통적인 형태보다 연구 단계에서 검증된 기술과 플랫폼이 먼저 글로벌 시장으로 연결된다. 대전에서 설계된 신약 후보와 기술이 글로벌 제약사 개발 파이프라인으로 편입되고 이후 임상과 상업화는 파트너 기업이 이어가는 구조다. 연구 성과를 지역 안에 붙잡기보다 다음 단계를 가장 잘 수행할 수 있는 주체와 연결하는 전략이 자리 잡아가고 있다는 분석이다. 이 과정에서 충청권 내 분업 구조도 함께 작동하고 있다. 대전이 신약 후보와 플랫폼 기술을 설계·검증하는 역할을 맡는다면 충북 오송은 임상과 제조 인프라를 중심으로 상업화 단계를 이어간다. 오름테라퓨틱 관계자는 ""모든 실험과 개발 단계를 대전에서 다 해결하려 하기보다 임상이나 공정 검증이 필요한 단계에서는 국내외 인프라를 자연스럽게 염두에 둔다""며 ""연구 설계 단계부터 다음 단계에서 어떤 설비와 환경이 필요한지를 고려해 개발 방향을 정한다""고 설명했다. 오송에는 LG화학, 대웅제약, 종근당바이오 등 대규모 의약품 생산 경험을 축적한 기업들이 입지해 있고, 첨단의료복합단지를 중심으로 임상과 공정 실증 환경도 구축돼 있다. 대전에서 검증된 기술이 오송의 생산·임상 인프라와 결합해 다음 단계로 이어지는 구조가 산업 현장에서 실제로 작동하고 있는 셈이다. 오름테라퓨틱 관계자는 ""대전은 단순히 연구 아이디어가 나오는 공간을 넘어 글로벌 제약사들이 실제로 판단하고 선택하는 기술이 만들어지는 출발점이다""라며 ""이곳에서 검증된 기술이 세계 시장으로 이어질 수 있도록 연구 단계부터 기준을 맞춰가고 있다""고 설명했다. 조정민 기자",https://www.cctoday.co.kr/news/articleView.html?idxno=2225630,https://cdn.cctoday.co.kr/news/thumbnail/202602/2225630_678777_3330_v150.jpg
2026-02-12,충청투데이,chungcheong,각개전투로는 수도권 못 넘는다 [K-바이오의 심장 충청 리포트],[K-바이오의 심장 충청권 리포트] 권역 전체 하나의 생태계로 묶어야,"[충청투데이 이석준 기자] 충청권 바이오산업이 수도권에 대응할 경쟁력을 확보하기 위해서는 개별 거점 중심의 발전 전략에서 벗어나야 한다는 지적이 나왔다.권역 전체를 하나의 전 주기 클러스터로 인식하고 기능별 분업과 연계를 강화해야 성장 잠재력을 키울 수 있다는 제언이다.정혜윤 한국은행 대전세종충남본부 경제조사팀 과장은 ""현재 대전은 신약 개발과 플랫폼 등 연구개발(R&D) 기능이 강하고, 충북은 오송을 중심으로 한 생산 인프라가 집적돼 있다""며 ""이 같은 강점을 단절적으로 운영하기보다 기능적으로 연결하는 구조가 중요하다""고 분석했다","[K-바이오의 심장 충청권 리포트] 권역 전체 하나의 생태계로 묶어야 [충청투데이 이석준 기자] 충청권 바이오산업이 수도권에 대응할 경쟁력을 확보하기 위해서는 개별 거점 중심의 발전 전략에서 벗어나야 한다는 지적이 나왔다. 권역 전체를 하나의 전 주기 클러스터로 인식하고 기능별 분업과 연계를 강화해야 성장 잠재력을 키울 수 있다는 제언이다. 정혜윤 한국은행 대전세종충남본부 경제조사팀 과장은 ""현재 대전은 신약 개발과 플랫폼 등 연구개발(R&D) 기능이 강하고, 충북은 오송을 중심으로 한 생산 인프라가 집적돼 있다""며 ""이 같은 강점을 단절적으로 운영하기보다 기능적으로 연결하는 구조가 중요하다""고 분석했다. 이어 ""세종과 충남의 경우 식품·바이오 중심 산업 비중이 높다는 점에서 향후 의약 바이오 분야로 확장할 가능성도 충분하다""고 설명했다. 실제로 지난해 11월부터 SK바이오텍은 세종 명학산업단지에 펩타이드 생산 공장을 짓고 있으며, 충남에도 셀트리온이 바이오의약품 생산 공장을 2028년까지 구축한다는 계획을 발표하는 등 권역 전반의 생산 기반 확장 움직임이 본격화하고 있다. 정 과장은 클러스터 형성에 대해서 ""대전의 R&D와 세종·충남의 중간 공정, 충북의 생산 공정을 유기적으로 연결하는 방식으로 특화 기능을 결합하면 권역 전체의 산업 경쟁력을 한 단계 끌어올릴 수 있을 것""이라며 ""이를 위해서는 지자체 간 협업 채널과 민간 교류 등 실행력을 담보할 종합적 대책이 필요하다""고 전했다. 클러스터의 구성 방식에 대해서는 특화형·개방형 클러스터 전략이 효과적이라는 주장도 제기됐다. 김은영 대전연구원 경제사회연구실 연구위원은 ""각 지역의 부족한 부분을 기능적으로 분업해 특성을 살리는 특화형·개방형 방식이 효과적일 것""이라며 ""후쿠오카가 R&D·서비스를, 기타큐슈가 제조를 담당하고 양 도시의 항만을 통해 수출하는 기능적 분업 모델을 벤치마킹할 필요가 있다""고 강조했다. 특히 세종은 마크로젠 세종캠퍼스를 선도 기업으로 하는 혁신 생태계 조성, 충남은 바이오·의료기기 제조·수출과 그린바이오 분야에서 강점을 갖는다는 점에서 충청권 전체 산업 생태계를 뒷받침하는 핵심 축으로 자리매김할 수 있다는 분석이다. 다만 세종과 충남은 인프라가 상대적으로 초기 단계에 있다는 점에서 김 연구위원은 ""세종은 데이터 특화 R&D 센터 유치를 통해 대전의 실험실 기반 R&D와 차별화된 연구가 가능하게 해야 한다""며 ""동시에 충남은 R&D 집적지구를 바이오·의료기기 시범 생산 거점으로 육성하는 등의 노력으로 잠재력을 끌어내는 것이 중요하다""고 진단했다. 김 연구위원은 ""이러한 클러스터를 구성하기 위해서는 초광역 거버넌스 기구가 필요하다""며 ""4개 시도 간 공공 인프라 활용 협약과 성장 단계별 기업 연계와 지원 시스템을 구축해야 한다""고 말했다. 이석준 기자",https://www.cctoday.co.kr/news/articleView.html?idxno=2225626,https://cdn.cctoday.co.kr/news/thumbnail/202602/2225626_678767_271_v150.jpg
