date,press,region,title,sub_title,description,content,article_url,image_url
2026-01-30,한국경제,national,"美 재무부, 환율보고서에서 또 ""韓 펀더멘털과 불일치"" 판단",,"2025년 하반기 원·달러 환율 급상승이 한국 경제 펀더멘털과는 부합하지 않는다는 미국 재무부 판단이 재차 나왔다. 통상 대미 무역흑자나 경상수지 트렌드를 평가, 분석하는 보고서에서 이례적으로 환율 수준을 콕 집어 언급했다.미국 재무부는 29일(현지시간) ...","2025년 하반기 원·달러 환율 급상승이 한국 경제 펀더멘털과는 부합하지 않는다는 미국 재무부 판단이 재차 나왔다. 통상 대미 무역흑자나 경상수지 트렌드를 평가, 분석하는 보고서에서 이례적으로 환율 수준을 콕 집어 언급했다. 미국 재무부는 29일(현지시간) 미국과 교역 규모가 큰 상위 20개국을 대상으로 ‘주요 교역상대국의 거시경제·환율정책 보고서(환율보고서)’를 발간했다. 이 보고서는 2024년 7월~2025년 6월까지의 거시 및 환율정책을 평가해 교역 상대국을 환율관찰대상국이나 환율조작국 등으로 분류한다 한국은 2023년 11월 환율관찰대상국에서 빠진 뒤 미국 도널드 트럼프 2기 행정부 출범 전인 2024년 11월 다시 포함됐고, 2025년 6월에 이어 이날 발표까지 3회 연속 지정됐다. 환율보고서는 통상 상반기(5월~6월) 한번, 하반기(11월~12월) 한번 발표되는데 이번 보고서는 미국 연방정부 셧다운(일시적 업무정지) 여파로 1월에 나오게 됐다. 미국 교역촉진법상 교역상대국을 평가하는 기준은  △대미 무역 흑자가 150억달러 이상인지 (현저한 대미 무역흑자) △국내총생산(GDP) 3% 이상이 경상수지 흑자인지(상당한 경상흑자) △12개월 중 8개월 이상 달러 순매수 금액이 GDP의 2% 이상인지(지속적 일방향 시장개입) 등이다. 3가지 요건 중 2가지에 해당하면 관찰대상국이, 3가지 모두 해당되면 환율조작국으로 분류된다. 한국은 2024년 7월~2025년 6월 대미 무역흑자가 520억달러고, 경상흑자가 GDP 대비 5.9%라 2가지 요건에 해당돼 환율관찰대상국으로 분류됐다. 달러는 순매수가 아닌 순매도를 했기 때문에 3번째 요건은 제외됐다. 이번 보고서에서 눈여겨볼 대목은 미국 재무부가 2025년 하반기 원·달러 환율에 대해 “펀더멘털과 맞지 않다”고 분석한 점이다. 이번 환율보고서의 평가기간 대상이 아닌 2025년 하반기 상황에 대해, 그것도 무역흑자나 경상수지가 아닌 환율을 언급한 것은 이례적이라는 평가다. 미국 재무부는 “한국 경상수지 흑자는 기술 수출(technology export)에 힘입어 2023년 중반 이후 빠르게 확대됐다”며 “이러한 대규모 대외 흑자에도 불구하고 원화는 지속적인 약세 압력을 받아왔으며, 보고서 평가 기간 동안 당국은 외환을 순매도했다”고 말했다. 이어 “원화는 2025년 말 추가로 절하됐는데, 이는 한국의 견조한 경제 펀더멘털과는 부합하지 않는(not in line with) 움직임이었다”고 평가했다. 또 “2025년 원화 약세의 주된 요인은 한국은행(BOK) 표현에 따르면 ‘독특한 현상(unique phenomenon)’인 개인투자자들의 해외주식 매입에서 비롯됐다”며 “국민연금도 해외투자를 위해 외화 매입을 계속했지만 한국은행간 외환스왑이 원화 약세 압력을 완화하는데 기여했다”고 분석했다. 한국 자본시장에 대해서는 “상당한 개방성을 유지하고 있다”며 “외환시장과 금융부문의 취약성을 관리하기 위해 일부 거시건전성 조치를 유지하고 있다”고 설명했다. 남정민 기자",https://www.hankyung.com/article/202601302958i,https://img.hankyung.com/photo/202601/01.43083736.3.jpg
2026-01-29,한국경제,national,부동산 양도세·보유세 개편안 이르면 7월 말 발표,,정부가 부동산 보유세와 거래세 개편안을 이르면 올해 7월 말 세제개편안에 담아 발표하는 방안을 검토하고 있다.강기룡 재정경제부 차관보는 29일 정부서울청사에서 열린 ‘도심 주택공급 확대 및 신속화 방안’ 브리핑에서 부동산 세제 대책과 관련해 “보유세와 거래세를 포함한 합리적인 조세 개편 방안을 차근차근 준비하고 있다&rdqu...,"정부가 부동산 보유세와 거래세 개편안을 이르면 올해 7월 말 세제개편안에 담아 발표하는 방안을 검토하고 있다. 강기룡 재정경제부 차관보는 29일 정부서울청사에서 열린 ‘도심 주택공급 확대 및 신속화 방안’ 브리핑에서 부동산 세제 대책과 관련해 “보유세와 거래세를 포함한 합리적인 조세 개편 방안을 차근차근 준비하고 있다”고 밝혔다. 대책 발표 시점에 관해선 “전반적인 조세 제도 부분은 굉장히 시간이 걸리는 문제로 연구용역을 진행하고 있고 관계부처 간 협의도 하고 있다”고 강조했다. 이날 정부 발표는 “연구용역 등을 통해 부동산 세제 합리화 방안을 검토하겠다”는 기존 입장에서 한 발짝 더 나아간 것으로 평가됐다. 정부 고위 관계자는 “이르면 오는 7월 말로 예정된 올해 세제개편안에 부동산 세제 합리화 방안을 담는다는 목표로 검토 중”이라고 전했다. 정부 안팎에선 재산세, 종합부동산세 등 보유세 체계와 취득세, 양도소득세 등 거래세 전반에 관한 개편안이 논의될 것으로 예상하고 있다. 앞서 이재명 대통령은 여러 차례 “비거주 1주택도 주거 목적이 아니라 투자·투기용이라면 장기 보유 혜택을 주는 것은 합당하지 않다”고 지적했다. 김용범 청와대 정책실장도 언론 인터뷰 등에서 “보유세도 소득세처럼 과표 구간을 보다 촘촘히 해야 한다는 제안이 있는데, 진지하게 검토할 사안”이라며 보유세 과세표준 개편 필요성을 거론했다. 정부는 5월 9일로 종료될 다주택자 양도세 중과 유예 조치와 관련해서는 ‘완충 기간’을 두겠다는 방침을 재확인했다. 강 차관보는 “10·15 대책으로 토지거래허가구역으로 지정된 지역에 대한 고려가 필요하고, 매매계약 체결 이후 잔금을 치러야 양도가 완료되는 만큼 그 소요 기간을 감안해 시뮬레이션을 하고 있다”며 “(이를 위한) 시행령 개정 작업은 오래 걸리지는 않는다”고 설명했다. 이광식 기자",https://www.hankyung.com/article/2026012918231,
2026-01-29,한국경제,national,"김성주 ""자동조정장치 반대…연금 고갈 막으려면 국고 투입해야""",,김성주 국민연금공단 이사장이 “21세기 말까지 국민연금 기금이 소진되지 않도록 하겠다”면서도 경제 상황에 따라 연금 수령액 등을 조정하는 ‘자동조정장치’ 도입에는 반대한다고 밝혔다. 그 대신 국민연금 기금 고갈을 막기 위한 방안으로 국고 조기 투입 필요성을 주장했다.김 이사장은 29일 서울 동자동에서 신년 기자간담...,"김성주 국민연금공단 이사장이 “21세기 말까지 국민연금 기금이 소진되지 않도록 하겠다”면서도 경제 상황에 따라 연금 수령액 등을 조정하는 ‘자동조정장치’ 도입에는 반대한다고 밝혔다. 그 대신 국민연금 기금 고갈을 막기 위한 방안으로 국고 조기 투입 필요성을 주장했다. 김 이사장은 29일 서울 동자동에서 신년 기자간담회를 열고 “2025년엔 모수개혁으로 재정 안정화를 위한 걸음을 내디뎠다면, 향후 추가 개혁은 소득 보장에 방점을 찍겠다”며 이같이 밝혔다. 연금 추가 개혁 논의에서 재정 안정성보다 소득 보장을 중시하겠다는 뜻으로 해석됐다. 그는 특히 자동조정장치에 대해 “논란이 있다”며 부정적 인식을 드러냈다. 김 이사장은 “충분한 노후 소득 보장이 이뤄지지 않은 상태에서 급여 삭감을 중심으로 한 자동조정장치가 도입되면 또 다른 노후 빈곤 문제에 직면할 수 있다”며 “이미 제도를 도입한 일본·독일과 한국의 여건 차이를 감안해야 한다”고 말했다. 그동안 기금의 재정 건전성을 중시하는 진영에서는 유례없는 고령화·저출생 여파로 미래 세대의 보험료 부담이 급격히 늘어날 수밖에 없다는 점에서 자동조정장치를 반드시 도입해야 한다고 주장해왔다. 지난해 ‘더 내고 더 받는’ 국민연금 개혁이 이뤄지면서 기금 고갈 시점은 2064년으로 기존보다 8년 늦춰졌지만, 재정의 지속 가능성에 대한 우려는 해소되지 않았다. 김 이사장은 기금 소진을 늦추기 위한 대안으로 국고 조기 투입을 거론하며 “국민, 연금공단, 국가 세 주체가 함께 기여해야 기금 소진 없는 연금 제도가 가능하다”고 말했다. 이어 “우리나라의 국가 역할은 독일, 일본에 비해 상대적으로 적다”며 “예컨대 현재 시행 중인 출산 크레딧도 65세 연금 수령 때가 아니라 출산 당시 바로 국고 지원이 이뤄져야 한다”고 주장했다. 다만 재정경제부는 국고 지원이 확대되면 당장 국채 발행에 따른 이자 부담이 적지 않은 데다 국민연금은 이미 1400조원이 넘는 자산을 운용하고 있기 때문에 국고 지원의 우선 대상이 아니라고 판단하고 있다. 남정민 기자",https://www.hankyung.com/article/2026012918511,
2026-01-29,한국경제,national,연기금 평가에 코스닥지수 반영,,정부가 코스닥시장 활성화를 위해 연기금의 운용 성과를 평가할 때 코스닥지수를 반영한다.기획예산처는 29일 발표한 ‘2026회계연도 기금운용평가 지침’에서 대형·중소형 기금의 평가 기준수익률(벤치마크)을 기존 ‘코스피지수 100%’에서 ‘코스피지수 95%+코스닥150지수 5%’로 변...,"정부가 코스닥시장 활성화를 위해 연기금의 운용 성과를 평가할 때 코스닥지수를 반영한다. 기획예산처는 29일 발표한 ‘2026회계연도 기금운용평가 지침’에서 대형·중소형 기금의 평가 기준수익률(벤치마크)을 기존 ‘코스피지수 100%’에서 ‘코스피지수 95%+코스닥150지수 5%’로 변경했다. 수익률 평가를 코스닥150지수에 연동되는 구조로 바꾼 것이다. 국민연금은 기존 평가 기준을 유지한다. 정부는 연기금 기금운용평가에서 벤처투자 항목의 배점도 현행 1점에서 2점으로 두 배 상향했다. 대형·중소형 기금뿐 아니라 국민연금에도 적용된다. 이 같은 지침 개편은 연기금의 코스닥시장, 벤처기업 투자를 촉진하기 위한 대책으로 평가됐다. 2024년 기준 연기금의 코스닥시장 투자 규모는 5조8000억원으로 전체 국내 주식 투자액의 3.7%에 그쳤다. 기금운용평가는 국가재정법에 따라 매년 실시되는 제도로, 기금을 운용하는 공공기관의 경영평가와 기금 존치 여부 평가에 반영된다. 평가 대상은 정부 관리 아래 있는 연기금 67개다. 이들의 운용자산 규모는 지난해 기준 1400조원에 달하는 것으로 추산된다. 김익환 기자",https://www.hankyung.com/article/2026012918371,
2026-01-29,한국경제,national,3000닥 뒷받침…1400조 연기금 코스닥·벤처 투자 북돋는다,,국민연금과 고용보험기금을 비롯한 연기금의 운용 평가 기준에 코스닥 지수가 반영된다. 여당이 제시한 ‘코스닥지수 3000’ ...,"국민연금과 고용보험기금을 비롯한 연기금의 운용 평가 기준에 코스닥 지수가 반영된다. 여당이 제시한 ‘코스닥지수 3000’ 목표를 뒷받침하기 위한 정책의 일환으로 풀이된다. 기획예산처는 29일 이 같은 내용을 담은 ’2026회계연도 기금운용평가 지침‘을 발표했다. 기금운용평가는 국가재정법에 따라 매년 실시되는 제도로, 기금을 운용하는 공공기관의 경영평가와 기금 존치 여부 평가에 반영된다. 평가 대상은 정부 관리 아래 있는 연기금 67개다. 이들의 운용자산 규모는 지난해 약 1400조원에 달하는 것으로 추산된다. 정부는 이번 지침을 통해 연기금 기금운용평가에서 벤처투자 항목의 배점을 현행 1점에서 2점으로 두 배 상향했다. 국민연금 같은 대규모 기금은 물론 대형·중소형 기금까지 모두 동일하게 적용된다. 벤처펀드 결성 초기 단계(결성 후 3년까지)의 수익률은 평가 대상에서 제외해 신규 벤처투자에 대한 부담을 낮췄다. 국민연금을 제외한 대형·중소형 기금의 평가 기준수익률(벤치마크)을 기존 ‘코스피지수 100%’에서 ‘코스피지수 95% + 코스닥150지수 5%’로 변경했다. 코스닥150지수에 투자하지 않으면 수익률 평가에서 불리해지도록 구조를 바꾼 것이다. 이번 지침 개편은 연기금의 코스닥 투자를 제도적으로 유도하기 위한 조치로 해석된다. 2024년 기준 연기금의 코스닥 투자 규모는 5조8000억원으로 전체 국내주식 투자액의 3.7%에 그쳤다. 김익환 기자",https://www.hankyung.com/article/202601291318i,https://img.hankyung.com/photo/202601/ZN.43114441.3.jpg
2026-01-29,한국경제,national,확대거시경제금융회의,,구윤철 부총리 겸 재정경제부 장관이 29일 서울 종로구 정부서울청사에서 열린 확대거시경제금융회의에서 발언하고 있다. 이솔 기자 soul5404@hankyung.com,구윤철 부총리 겸 재정경제부 장관이 29일 서울 종로구 정부서울청사에서 열린 확대거시경제금융회의에서 발언하고 있다. 이솔 기자,https://www.hankyung.com/article/202601291317i,https://img.hankyung.com/photo/202601/01.43119276.3.jpg
2026-01-29,한국경제,national,"""코스피 7000까지도 가능""…'李 대통령 경제 멘토'의 진단",,“코스피지수가 7000까지 갈 수 있다고 생각했지만 대외적으로는 5000만 이야기했습니다.”이재명 대통령의 ‘경제 멘토’로 불리는 이한주 경제인문사회연구회(NRC) 이사장은 29일 기자간담회에서 이같이 밝혔다. 가천대 경제학과...,"“코스피지수가 7000까지 갈 수 있다고 생각했지만 대외적으로는 5000만 이야기했습니다.” 이재명 대통령의 ‘경제 멘토’로 불리는 이한주 경제인문사회연구회(NRC) 이사장은 29일 기자간담회에서 이같이 밝혔다. 가천대 경제학과 교수 출신인 이 이사장은 이 대통령과 40여 년 인연을 이어온 인물로, 이 대통령이 경기지사로 재임하던 시절 경기연구원장을 맡아 기본소득 등 주요 경제 정책의 밑그림을 설계했다. 지난해 11월에는 한국개발연구원(KDI) 등 경제·인문사회 분야 국책 연구기관 26곳을 총괄하는 NRC 이사장에 선임됐다. 이한주 이사장은 이날 기자간담회에서 코스피 7000에 대해 “경제에는 자기실현적 성격이 있고, 특히 자본시장은 그 성향이 더 강하다”고 말했다. 그러면서 “이재명 정부 출범 전 코스피지수의 주가순자산비율(PBR)은 1 수준이었다”며 “선진국 평균 PBR이 3인 점을 대입하면 코스피지수는 7500 수준이 된다”고 설명했다. 그는 “개발도상국 대표 주가지수의 PBR이 2 정도인 점을 적용하면 코스피지수는 5000 수준”이라며 “현실적으로 5000~7500선까지 갈 가능성을 봤다”고 덧붙였다. 하지만 자본시장과 달리 실물경제는 여전히 차갑다고 분석했다. 그는 “국민 생활과 직결된 도소매업, 숙박·음식업 경기가 매우 좋지 않다”며 “이 부문이 살아날 수 있도록 민생경제 중심의 정책 집중이 필요하다”고 말했다. 최근 이재명 대통령이 X(옛 트위터)를 통해 각종 정책 제안을 연이어 내놓는 데 대해서는 “대통령은 정책자료뿐 아니라 스마트폰 등을 통해 다양한 자료를 직접 보고 있다”며 “이를 참모들에게 지속적으로 전달하고 있다”고 설명했다. 이어 “아무 생각 없이 글을 쓰는 것이 아니라 의제 설정 차원에서 문제를 던지는 것""이라며 ""참모진의 긴장감을 높이기 위한 측면도 있다”고 했다. 최근 국무회의에서 이 대통령이 임광현 국세청장을 질책하는 듯한 모습을 보인 데 대해서는 ""내수경기가 좋지 않아서 세금을 많이 못 걷는 상황""이라며 ""악당들(체납자)한테서 먼저 세금을 걷으려고 하다 보니 그렇게 이야기하는 것""이라고 말했다. 외부 연구과제 수주 시 인건비 일부 충당을 허용하던 PBS(성과기반 급여체계) 제도 폐지에 대해서는 “산하 연구진이 과도하게 외부 연구 수주 경쟁에 매달리는 예산 추구적 행태가 있었다”며 “필요한 인건비와 사업비는 국가가 책임지고 지원하되, 국가 정책 연구에 집중하라는 취지”라고 설명했다. NRC 산하 통일연구원의 통일부 이관 논란과 관련해서는 “법 개정이 필요한 사안인 만큼 국회에서 판단할 문제”라고 밝혔다. 앞서 통일부는 국책연구기관인 통일연구원을 부처 산하로 이관하는 내용의 법안을 입법예고했다가 사흘 만에 철회한 바 있다. 이와 관련해 이 이사장은 정동영 통일부 장관과 만났지만, 구체적인 논의 내용에 대해서는 말을 아꼈다. 김익환 기자",https://www.hankyung.com/article/202601291060i,https://img.hankyung.com/photo/202601/01.41132260.3.jpg
2026-01-29,한국경제,national,보복 우려 차단…공정위 'IP 추적 불가' 익명제보 도입,,"공정거래위원회가 하도급·유통·대리점·가맹 분야에서 발생하는 불공정 관행을 근절하기 위해 익명제보센터 운영을 대폭 강화한다. 제보자의 신원을 원천적으로 확인할 수 없도록 해, 보복 걱정 없이 신고할 수 있는 환경을 만들겠다는 취지다....","공정거래위원회가 하도급·유통·대리점·가맹 분야에서 발생하는 불공정 관행을 근절하기 위해 익명제보센터 운영을 대폭 강화한다. 제보자의 신원을 원천적으로 확인할 수 없도록 해, 보복 걱정 없이 신고할 수 있는 환경을 만들겠다는 취지다. 공정위는 29일 익명제보센터의 조사 방식과 절차, 전담 인력 체계를 전면 개편한다고 밝혔다. 이번 조치는 지난해 12월 업무보고에서 이재명 대통령이 “거래 단절 등의 우려로 신고가 어려운 중소기업의 불공정 행위를 익명성을 보장한 채 조사할 수 있는 방안을 마련하라”고 지시한 데 따른 후속 조치다. 앞으로는 제보 과정에서 작성자의 IP 주소를 아예 저장하지 않는 방식이 적용된다. 담당 공무원 역시 제보자의 신원을 확인할 수 없도록 시스템이 설계돼, 내부를 통한 신원 노출 가능성도 차단된다. 조사 방식도 달라진다. 그동안에는 제보 대상 기업의 다른 거래까지 조사하는 과정에서 제보자를 추정할 수 있다는 우려가 제기돼 왔다. 이에 따라 공정위는 특정 기업에 한정해 조사하기보다, 해당 업종이나 분야 전반의 유사 사례로 조사 범위를 넓힐 방침이다. 제보 처리 속도도 빨라진다. 기존에는 제보 내용을 한 달 단위로 검토했지만, 앞으로는 이를 2주 단위로 단축한다. 전담 인력도 분야별 1명 수준에서 최대 5명으로 늘려 전담팀을 운영한다. 공정위 관계자는 “익명제보 강화로 보복 우려 때문에 드러나지 않았던 불공정 관행을 보다 폭넓게 포착할 수 있을 것”이라며 “수급사업자·납품업자·가맹점주 등 경제적 약자의 피해를 신속히 구제하고, 불공정행위에 대한 경각심을 높이겠다”고 말했다. 하지은 기자",https://www.hankyung.com/article/202601291056i,https://img.hankyung.com/photo/202601/AD.42798723.3.jpg
2026-01-29,한국경제,national,금리인하 멈춘 美 중앙은행…한은도 '장기 동결' 가능성,,"미국 중앙은행(Fed)이 기준금리 인하를 멈추면서 한국은행도 당분간 금리를 동결할 가능성이 커지고 있다. 美 중앙은행은 28일(현지시간) 기준금리를 연 3.50∼3.75%로 동결했다. 제롬 파월 의장은 ""경제지표 등 모든 것이 올해 성장세가 견조한 기반...","미국 중앙은행(Fed)이 기준금리 인하를 멈추면서 한국은행도 당분간 금리를 동결할 가능성이 커지고 있다. 美 중앙은행은 28일(현지시간) 기준금리를 연 3.50∼3.75%로 동결했다. 제롬 파월 의장은 ""경제지표 등 모든 것이 올해 성장세가 견조한 기반에서 시작됐음을 시사한다""며 경기 호조를 동결 배경으로 지목했다. 연방공개시장위원회(FOMC) 정례회의 의결문에서도 미국 성장세를 '견조하다'고 평가하는 동시에 '고용에 대한 하방 리스크가 최근 몇 달간 상승했다'는 문구를 삭제했다. 경기와 성장을 위해 금리를 서둘러 낮출 이유가 없다는 뜻이다. 아울러 파월 의장이 현재 금리 수준과 관련해 ""(물가안정과 고용 극대화) 이중 책무 사이에서 직면한 위험에 대응할 수 있는 좋은 위치에 있다""고 진단한 만큼, 당분간 동결 기조가 이어질 것으로 예상된다. 미국이 지난해 9·10·12월 연속으로 단행했던 금리 인하를 멈추면서 내달 26일 통화정책 방향 회의를 앞둔 한국은행이 금리를 동결할 가능성이 높아졌다. 굳이 금리를 더 낮춰 현재 1.25%포인트(p)인 격차를 키우고 원/달러 환율 상승과 외국인 투자자금 유출 압박을 자초할 이유가 없기 때문이다. 지난 15일 회의에서 금통위는 당시 1500원을 넘보는 높은 원/달러 환율을 고려해 금리를 2.50%에서 묶었다. 이후 달러가 약세로 돌아서면서 지난 28일 환율은 서울 외환시장에서 주간(낮) 거래 종가(오후 3시 30분) 기준으로 1422.5원까지 떨어졌다. 지난해 10월 20일(1419.2원) 이후 가장 낮은 수준이다. 전문가들 사이에서는 한은이 길게는 올해 내내 동결 기조를 이어갈 수 있다는 관측도 나온다. 소비·투자 지원을 위해 기준금리 인하까지 동원할 만큼 경기 상황이 절박하지 않은데다, 집값과 물가 불안도 남아 있기 때문이다. 다만 금리 인상도 쉽게 나설 수 없는 처지라는 분석이다. 이창용 한은 총재는 지난 5일 '범금융 신년 인사회'에서 ""지난해보다 높은 성장률을 기록할 것으로 전망되지만, 부문 간 격차가 큰 'K자형 회복' 때문에 체감 경기와 괴리가 클 것""이라고 우려했다. 경기 회복이 일부 산업·계층에 편중된 'K자형(양극화)'으로 진행될 수 있는 만큼 한은은 경기 위축을 감수하면서까지 금리 인상에 나서기보단 동결 기조를 이어갈 것이라는 관측이다. 오세성 한경닷컴 기자",https://www.hankyung.com/article/2026012996767,https://img.hankyung.com/photo/202601/ZA.43032862.3.jpg
