date,press,region,title,sub_title,description,content,article_url,image_url
2026-02-02,충청투데이,chungcheong,"대전농협-북대전농협, 송강사회복지관에 쌀 500kg 전달",,[충청투데이 이석준 기자] 농협 대전본부와 북대전농협은 2일 민족 최대의 명절인 설을 맞아 대전 유성구에 위치한 송강사회복지관을 찾아 지역 쌀 500㎏을 전달했다.지역사회 취약계층을 위한 따뜻한 나눔 문화 확산과 범농협 농심천심운동의 일환으로 마련된 이날 행사에서 박재명 농협 대전본부장과 심청용 북대전농협 조합장은 시설 관계자들을 만나 정성껏 준비한 지역 쌀을 전달했다.대전농협은 올 한 해에도 동심협력(同心協力)의 마음으로 지역사회와 함께하는 사회공헌활동을 지속적으로 실천할 계획이다.박재명 본부장은 “민족 고유의 명절인 설을 앞두고,[충청투데이 이석준 기자] 농협 대전본부와 북대전농협은 2일 민족 최대의 명절인 설을 맞아 대전 유성구에 위치한 송강사회복지관을 찾아 지역 쌀 500㎏을 전달했다. 지역사회 취약계층을 위한 따뜻한 나눔 문화 확산과 범농협 농심천심운동의 일환으로 마련된 이날 행사에서 박재명 농협 대전본부장과 심청용 북대전농협 조합장은 시설 관계자들을 만나 정성껏 준비한 지역 쌀을 전달했다. 대전농협은 올 한 해에도 동심협력(同心協力)의 마음으로 지역사회와 함께하는 사회공헌활동을 지속적으로 실천할 계획이다. 박재명 본부장은 “민족 고유의 명절인 설을 앞두고 우리 지역 쌀이 취약계층 복지 증진과 농업인의 행복으로 이어지길 바란다”며 “앞으로도 건강한 먹거리를 생산하는 농부의 마음이 곧 하늘의 뜻이라는 의미를 담고 있는 농심천심(農心天心)운동을 전사적으로 추진하여 국민에게 사랑받는 농협으로 거듭나겠다”고 말했다. 이석준 기자,https://www.cctoday.co.kr/news/articleView.html?idxno=2225077,https://cdn.cctoday.co.kr/news/thumbnail/202602/2225077_677990_0002_v150.jpg
2026-02-02,충청투데이,chungcheong,구호가 아닌 도시 생존전략…민선8기 4년의 방향 전환,[시리즈] 계룡은 왜 ‘국방수도’를 선택했나 <1>구호가 아닌 도시 생존전략… 민선8기 4년의 방향 전환 성장 없는 안정은 없다…계룡이 마주한 구조적 한계,"[충청투데이 김흥준 기자] 계룡시는 더 이상 ‘군부대가 있는 도시’에 머물 수 없다. 민선8기 이후 계룡은 국방 첨단산업과 군문화 세계화를 도시 전략의 중심에 두고 과감한 실험을 이어가고 있다. 본지는 3회에 걸쳐 국방수도 전략의 출발과 배경, 지난 4년간의 변화와 성과, 2026년을 기점으로 계룡이 마주한 과제와 가능성을 짚어본다. 이번 기획은 계룡이 선언을 넘어 결과로 평가받는 도시로 갈 수 있는지를 묻는 기록이다.계룡시가 2026년을 ‘도약의 해’로 설정한 것은 단순한 연도 선언이 아니다.민선8기 출범 이후 4년 동","[시리즈] 계룡은 왜 ‘국방수도’를 선택했나 <1>구호가 아닌 도시 생존전략… 민선8기 4년의 방향 전환 성장 없는 안정은 없다…계룡이 마주한 구조적 한계 [충청투데이 김흥준 기자] 계룡시는 더 이상 ‘군부대가 있는 도시’에 머물 수 없다. 민선8기 이후 계룡은 국방 첨단산업과 군문화 세계화를 도시 전략의 중심에 두고 과감한 실험을 이어가고 있다. 본지는 3회에 걸쳐 국방수도 전략의 출발과 배경, 지난 4년간의 변화와 성과, 2026년을 기점으로 계룡이 마주한 과제와 가능성을 짚어본다. 이번 기획은 계룡이 선언을 넘어 결과로 평가받는 도시로 갈 수 있는지를 묻는 기록이다.<편집자주> 계룡시가 2026년을 ‘도약의 해’로 설정한 것은 단순한 연도 선언이 아니다. 민선8기 출범 이후 4년 동안 축적해 온 정책 방향과 성과를 집약해, 도시의 미래를 결정짓겠다는 전략적 분기점이다. 계룡은 오랫동안 군 관련 도시라는 정체성만 존재했지, 산업도시도, 관광도시도 아니었다. 인구는 정체됐고, 세수 기반은 약했으며, 자체 성장 동력은 부족했다. ‘군’이라는 상징은 있었지만, 그것이 도시의 경제와 생활로 이어지지는 못했다. 이 구조적 한계를 넘어설 돌파구로 선택한 것이 바로 국방 첨단산업과 군문화 세계화라는 두 개의 축이다. 계룡시는 이를 통해 산업·연구·관광·교통이 유기적으로 연결되는 국방 생태계를 구축하겠다는 전략을 세웠다. 단순한 구호가 아닌 실행 전략도 구체화됐다. 공공임대형 지식산업센터, 국방 첨단기술 특화산업단지, 지능형센서 스핀온 지원센터를 통해 국방 R&D 기반을 조성하고, 국방 관련 공공기관 유치를 통해 인적·기술 집적화를 꾀하고 있다. 특히 하대실2지구에는 제2차 공공기관 이전을 대비한 공공청사 용지를 확보하고, 국방신속획득기술연구원과 국군의무사관학교 등 핵심 기관 유치를 목표로 행정·산업 거점화를 추진 중이다. 문화 역시 산업 전략의 일부다. 계룡군문화축제와 KADEX는 더 이상 단순한 지역행사가 아니다. 2026년 KADEX, 2029년 세계군문화엑스포 국제행사 승인이라는 장기 목표를 설정해 도시 브랜드를 세계화하겠다는 구상이다. 여기에 병영체험관, 국립군사미래박물관, 관광벨트 조성, 환승센터, 광역교통망 확충까지 더해지면서 계룡은 단절된 군도시에서 연결된 국방 클러스터로 전환을 시도하고 있다. 이응우 시장은 “계룡은 이제 상징의 도시가 아니라, 전략으로 움직이는 도시로 가야 한다”며 “국방과 문화, 산업이 하나로 작동하는 도시 모델을 완성하겠다”고 강조했다. 김흥준 기자",https://www.cctoday.co.kr/news/articleView.html?idxno=2225063,https://cdn.cctoday.co.kr/news/thumbnail/202602/2225063_677972_2501_v150.jpg
2026-02-02,충청투데이,chungcheong,"[단독] 대전 중부소방서 신설, 예산 없어 무기한 연기",착공예정일 10개월 넘게 첫삽 못떠 필요한 예산 절반도 못받아 미뤄져 추경으로 확보해도 9월에나 착공 대전서 유일하게 중구만 소방서無,"[충청투데이 김중곤 기자] 대전 5개구 중 중구에만 없는 소방서 신설 사업이 예산 확보에 난항을 겪으면서 사실상 ‘무기한 착공 지연’ 상태에 빠진 것으로 파악됐다.1일 대전소방본부에 따르면 지난해 4월 착공이 계획됐던 중부서 건립 공사가 약 10개월이 지난 현재까지 첫 삽을 뜨지 못하고 있다.중부서 신설 사업은 2020년 8월 기본계획 수립과 부지매매 계약 체결로 가시화됐고, 2024년 9월 실시설계를 마치며 본격 착공을 앞두고 있었다.하지만 사업비가 안정적으로 공급되지 못하면서 지금까지 착공이 이뤄지지 못하고 있다.시 소방본부는","착공예정일 10개월 넘게 첫삽 못떠 필요한 예산 절반도 못받아 미뤄져 추경으로 확보해도 9월에나 착공 대전서 유일하게 중구만 소방서無 [충청투데이 김중곤 기자] 대전 5개구 중 중구에만 없는 소방서 신설 사업이 예산 확보에 난항을 겪으면서 사실상 ‘무기한 착공 지연’ 상태에 빠진 것으로 파악됐다. 1일 대전소방본부에 따르면 지난해 4월 착공이 계획됐던 중부서 건립 공사가 약 10개월이 지난 현재까지 첫 삽을 뜨지 못하고 있다. 중부서 신설 사업은 2020년 8월 기본계획 수립과 부지매매 계약 체결로 가시화됐고, 2024년 9월 실시설계를 마치며 본격 착공을 앞두고 있었다. 하지만 사업비가 안정적으로 공급되지 못하면서 지금까지 착공이 이뤄지지 못하고 있다. 시 소방본부는 공사비 128억 700만원 중 74억 5000만원을 지난해부터 투입하려 했지만, 대전시로부터 내려온 예산은 올해 현재까지 42억 7800만원에 불과한 것으로 확인됐다. 2025년 본예산으로 20억원만 편성됐고 그해 추가경정예산도 반영되지 않으며 원래 계획에 맞춰 공사에 들어가지 못했다. 착공 시점을 지난해 11월로 한 차례 연기했지만, 올해 본예산도 한참 모자란 22억 7800만원만 배정되면서 불가능했다. 또 다시 오는 4월로 미룬 터파기마저도 올해 추경이 하반기에나 있을 것으로 예상돼 현실적으로 어려운 상황이다. 하반기 추경으로 필요한 예산을 모두 확보해도 오는 9월에나 첫 삽을 뜰 수 있다는 것이 시 소방본부 관계자의 설명이다. 완공 시점도 목표한 2027년 4월에서 2028년 8월로 1년 4개월 밀렸다. 시 소방본부 관계자는 ""부족한 사업비로 착공했다가 결국 공사가 멈추면 현장 부대비용이 추가로 발생하는 문제가 생긴다""며 ""추경은 6·3 지방선거가 있다 보니 하반기에나 가능하지 않을까 싶다""고 설명했다. 중구 부사동 126-5번지(부지면적 2694.5㎡)에 4층(연면적 3518㎡) 규모로 짓는 중부서는 대전 도심의 소방 인프라 불균형을 해소하는 차원에서 중요하다. 대전에는 동부, 둔산, 대덕, 유성, 서부까지 5개 소방서가 있지만, 5개구 중 서구에 2개서가 위치하면서 중구에는 한 곳도 없는 상황이다. 중구는 동부, 둔산, 서부 3개서의 5개 안전센터가 관할을 나눠 맡고 있다. 화재 등 재난에 대응하는 소방당국의 구심점이 대전 내 다른 구보다 약한 셈이다. 화재증명원이나 구조구급증명원 등 시민이 소방서를 방문해 처리해야 하는 민원 업무도 중구에선 3개서로 분산돼 있어 상대적으로 불편할 수밖에 없다. 프로야구 한화이글스의 홈구장과 폭발적 인기를 끄는 성심당 등 영향으로 중구 생활인구가 예전보다 크게 늘었다는 점도 중부서 신설 필요성을 뒷받침하는 요인이다. 고왕열 우송정보대 재난소방안전관리학과 교수는 ""소방은 대국민 서비스인 만큼 금전보다는 시민의 관점에서 접근해야 한다""며 ""대전 내 모든 구에 소방서가 개서할 수 있도록 예산을 신속히 확보해야 한다""고 말했다. 김중곤 기자",https://www.cctoday.co.kr/news/articleView.html?idxno=2225035,https://cdn.cctoday.co.kr/news/thumbnail/202602/2225035_677948_4245_v150.jpg
2026-02-02,충청투데이,chungcheong,"""제도·구조 없다면 AI 상용화 어렵다"" [AI 경쟁 현장 진단]","[AI 경쟁 현장 진단] AI기술 특성상 관리·고도화 필수 실증 이후 단계서 기업 부담 커져 ""현장·유지 적용 위한 新 구조 필요""","[충청투데이 조정민 기자] 지역 과학기술계 현장에서는 AI 상용화 성패가 기술 자체만큼이나 이를 둘러싼 운영과 제도 구조에 좌우될 수 있다고 입을 모은다.운영 주체, 유지·관리 비용, 성능 저하 보완 설계가 함께 이뤄지지 않으면 기술은 현장에 정착하기 어렵다는 지적이다.특히 AI 기술은 적용 환경에 따라 성능 변화가 크다는 점에서 지속적인 관리와 고도화가 필수적이다.실증이 작동 여부를 확인하는 과정이라면 상용화는 지속 가능성을 증명해야 하는 단계다.다만 연구 설계 단계에서부터 상용화 경로가 구체화되지 않으면 실증 이후 단계는 공백으","[AI 경쟁 현장 진단] AI기술 특성상 관리·고도화 필수 실증 이후 단계서 기업 부담 커져 ""현장·유지 적용 위한 新 구조 필요"" [충청투데이 조정민 기자] 지역 과학기술계 현장에서는 AI 상용화 성패가 기술 자체만큼이나 이를 둘러싼 운영과 제도 구조에 좌우될 수 있다고 입을 모은다. 운영 주체, 유지·관리 비용, 성능 저하 보완 설계가 함께 이뤄지지 않으면 기술은 현장에 정착하기 어렵다는 지적이다. 특히 AI 기술은 적용 환경에 따라 성능 변화가 크다는 점에서 지속적인 관리와 고도화가 필수적이다. 실증이 작동 여부를 확인하는 과정이라면 상용화는 지속 가능성을 증명해야 하는 단계다. 다만 연구 설계 단계에서부터 상용화 경로가 구체화되지 않으면 실증 이후 단계는 공백으로 남기 쉽다는 설명이다. 데이터 환경이 바뀌거나 현장 조건이 달라질 경우 초기 실증 단계에서 확보한 정확도가 유지되지 않는 사례도 적지 않다. 이 때문에 일회성 실증으로는 실제 운영 단계에서 발생하는 문제를 모두 검증하기 어렵다는 분석이 나온다. 현장 기업들은 실증 이후 단계에서 부담이 기업에 집중되는 구조를 한계로 꼽는다. 대전의 한 AI 기업 관계자는 ""실증 단계까지는 연구 협력이나 정부 과제로 진행되지만 이후 운영 단계로 넘어가면 비용과 책임이 모두 기업 몫이 되는 경우가 많다""며 ""기술력과 별개로 이를 감당할 수 있는 구조가 마련되지 않으면 상용화는 쉽지 않다""고 토로했다. 사업 구조와 지속 가능성이 더 큰 벽으로 작용할 수 있다는 것이다. AI 기술 특성상 현장과 연구 간 간극도 한계로 꼽힌다. 현장 전문가가 AI 모델을 쉽게 이해하고 활용할 수 있는 도구와 협업 구조가 충분히 마련되지 않을 경우 기술은 현장에 정착하기 어렵다는 설명이다. 결국 AI 성과를 늘리는 것만큼이나 성과가 멈추지 않고 이어질 수 있는 조건을 어떻게 마련할 것인지가 핵심 과제로 부상하고 있다. 김영일 우송대 AI·빅데이터학과 교수는 ""AI 상용화의 성패는 기술 자체보다 이를 둘러싼 설계와 운영 구조에 달려 있다""며 ""연구 단계부터 현장 적용과 유지까지를 하나의 흐름으로 바라보는 접근이 필요하다""고 강조했다. 조정민 기자",https://www.cctoday.co.kr/news/articleView.html?idxno=2225032,https://cdn.cctoday.co.kr/news/thumbnail/202602/2225032_677947_4148_v150.jpg
2026-02-02,충청투데이,chungcheong,"대덕특구 AI, 돌봄·제조 현장 ‘이미’ 장악했다 [AI 경쟁 현장진단]","[AI 경쟁 현장진단] ‘현장 개선 도구’ 접근 전략 성공 사례 많아 시민 안전·산업 경쟁력 직결 영역 체감도 ↑ 독립적 기술 아닌 기존 시스템 융합 ‘성공적’ ""현장서 적용 가능한 계속 쓸수 있는 구조 必""",[충청투데이 조정민 기자] #1. 대덕특구의 한 AI 기업은 비침습 공기압 센서와 인공지능(AI)을 결합한 생체신호 분석 기술을 개발해 지자체 돌봄 서비스 현장에 적용하고 있다. 별도의 웨어러블 기기를 착용하지 않아도 호흡과 심박 등 생체 신호를 감지할 수 있어 고령자 돌봄과 같은 생활 밀착형 서비스에 적합하다는 평가다. 단순 실증에 그치지 않고 실제 돌봄 현장에서 운영되며 이상 징후 감지와 모니터링에 활용되고 있다. 기업 측은 기술 성능 뿐 아니라 현장 운영 환경과 관리 방식까지 함께 설계한 점이 상용화로 이어질 수 있었던 요인이,"[AI 경쟁 현장진단] ‘현장 개선 도구’ 접근 전략 성공 사례 많아 시민 안전·산업 경쟁력 직결 영역 체감도 ↑ 독립적 기술 아닌 기존 시스템 융합 ‘성공적’ ""현장서 적용 가능한 계속 쓸수 있는 구조 必"" [충청투데이 조정민 기자]   대덕특구의 한 AI 기업은 비침습 공기압 센서와 인공지능(AI)을 결합한 생체신호 분석 기술을 개발해 지자체 돌봄 서비스 현장에 적용하고 있다. 별도의 웨어러블 기기를 착용하지 않아도 호흡과 심박 등 생체 신호를 감지할 수 있어 고령자 돌봄과 같은 생활 밀착형 서비스에 적합하다는 평가다. 단순 실증에 그치지 않고 실제 돌봄 현장에서 운영되며 이상 징후 감지와 모니터링에 활용되고 있다. 기업 측은 기술 성능 뿐 아니라 현장 운영 환경과 관리 방식까지 함께 설계한 점이 상용화로 이어질 수 있었던 요인이라고 설명한다.  또 다른 대덕특구 AI 기업인 ‘블루타일랩’은 반도체·이차전지·디스플레이 제조 공정에 적용되는 비전 검사 AI 기술을 개발해 양산 라인에 공급하고 있다. 기존 검사 공정을 완전히 대체하기보다 불량 판별 정확도를 높이는 보완 기술로 접근해 현장 수용성을 높였다. 연구기관 기술을 기반으로 출발해 실제 양산 환경에 맞춘 데이터 축적과 모델 고도화를 거쳐 대기업 협력사로 등록되는 성과를 냈다. AI 기술이 연구 성과에 머무르지 않고 산업 현장에 안착한 대표적인 사례로 꼽힌다. 정부가 AI 연구 성과 ‘체감도’를 강조하는 가운데 현장에서도 변화가 시작되고 있는 분위기다. 대전의 경우 대덕특구를 중심으로 일부 AI 기술은 실증 단계를 넘어 실제 운영 단계까지 진입하며 돌봄·제조 현장 등에서 성과를 내고 있다. 그동안 AI 기술은 가능성과 잠재력 위주로 소개되는 경우가 많았지만 현장에서 운영 단계까지 이어진 사례는 기술 성숙도를 가늠할 수 있는 지점으로도 평가된다. 특히 돌봄과 제조처럼 시민 안전과 산업 경쟁력에 직결되는 영역에서 AI가 활용되고 있다는 점은 체감도를 높이는 요소이기도 하다. 이들 사례의 공통점은 AI 기술을 넘어 적용 방식에 있다. 두 기업 모두 AI를 독립적인 기술로 내세우기보다 기존 시스템과 결합해 현장 부담을 줄이는 방향으로 설계했다. 돌봄 분야에서는 이용자의 부담을 최소화하는 방식으로, 제조 현장에서는 기존 공정을 흔들지 않는 보완 기술로 접근해 현장 수용성을 높였다. AI를 ‘대체 기술’이 아닌 ‘현장 개선 도구’로 접근한 전략이 실제 적용으로 이어졌다는 분석이다. 또 단기간 성능 검증에 그치지 않고 데이터 관리와 유지 방식, 현장 대응 체계까지 함께 고민하면서 운영 단계로 자연스럽게 넘어갈 수 있는 기반을 마련했다. AI 기술이 실험 환경이 아닌 실제 현장에서 지속 작동하기 위해서는 초기 단계부터 운영 조건을 함께 고려해야 한다는 점을 보여주는 사례다. 다만 이러한 성과가 아직은 일부 기업과 분야에 국한돼 있다는 점도 분명하다. AI 기술을 실증 단계까지 적용하는 사례는 늘고 있지만 그 이후 운영과 확산 단계로 이어지는 경우는 상대적으로 제한적이다. 김형우 블루타일랩 대표는 ""AI 기술이 현장에서 쓰이기 위해서는 ‘계속 쓸 수 있는 구조’를 만드는 게 중요하다""며 ""기술을 어떻게 현장에 맞게 적용하고 운영하느냐가 성과를 가르는 기준이 되고 있다""고 설명했다. 조정민 기자",https://www.cctoday.co.kr/news/articleView.html?idxno=2225031,https://cdn.cctoday.co.kr/news/thumbnail/202602/2225031_677945_3952_v150.jpg
2026-02-02,충청투데이,chungcheong,AI 현장서 쓰여야 경쟁력 커져…정부 정책 대전환 [AI 경쟁 현장진단],[AI 경쟁 현장진단] 과기부 ‘실증·확산·활용’ 구조 설계 의지 R&D성과 확산 단절 구간 해소 초점 맞춰 분야별 AI 전환 전주기 원스톱 체계 추진 공공 AI 데이터 민간·지역 확산 검토 중,[충청투데이 조정민 기자] AI를 둘러싼 정책 환경이 전환점에 들어섰다.알고리즘 성능이나 연구 성과 자체뿐 아니라 이를 실제 산업과 사회 전반에 얼마나 빠르게 확산시키느냐가 국가 경쟁력을 좌우하는 요소로 부상하는 모양새다.정부 역시 제2차 국가연구개발(R&D) 중장기 투자전략 수립 논의에서 AI를 포함한 핵심 기술의 성과를 연구 단계에 머무르지 않고 산업과 일상으로 연결하겠다는 방향을 제시했다.AI 시대 경쟁력이 ‘기술 보유’를 넘어 ‘현장 적용’에 있다는 판단이 정책 전반에도 반영되고 있는 셈이다.이 같은 방향은 구체적인 정책 설,"[AI 경쟁 현장진단] 과기부 ‘실증·확산·활용’ 구조 설계 의지 R&D성과 확산 단절 구간 해소 초점 맞춰 분야별 AI 전환 전주기 원스톱 체계 추진 공공 AI 데이터 민간·지역 확산 검토 중 [충청투데이 조정민 기자] AI를 둘러싼 정책 환경이 전환점에 들어섰다. 알고리즘 성능이나 연구 성과 자체뿐 아니라 이를 실제 산업과 사회 전반에 얼마나 빠르게 확산시키느냐가 국가 경쟁력을 좌우하는 요소로 부상하는 모양새다. 정부 역시 제2차 국가연구개발(R&D) 중장기 투자전략 수립 논의에서 AI를 포함한 핵심 기술의 성과를 연구 단계에 머무르지 않고 산업과 일상으로 연결하겠다는 방향을 제시했다. AI 시대 경쟁력이 ‘기술 보유’를 넘어 ‘현장 적용’에 있다는 판단이 정책 전반에도 반영되고 있는 셈이다. 이 같은 방향은 구체적인 정책 설계에서도 확인된다. 정부는 AI를 포함한 전략기술 분야에서 연구개발부터 실증, 사업화, 시장 창출까지 이어지는 ‘전주기 투자’를 핵심 기조로 제시했다. 연구개발 단계에서 끝나는 과제가 아닌 실증과 확산까지 연결될 수 있도록 투자 구조 자체를 재편하겠다는 의미다. 과학기술정보통신부는 2026년도 정부 R&D 투자 방향에서 AI를 포함한 ICT 분야 연구개발을 기술 개발에 그치지 않고 실증·확산·활용까지 이어지는 구조로 설계하겠다고 밝혔다. 특히 연구 성과가 실제 현장에서 활용될 수 있도록 실증 중심 과제 확대, 수요 기반 과제 기획, 민간·공공 연계를 통한 확산 구조 마련을 주요 과제로 제시했다. 성과 확산을 가로막아온 단절 구간을 해소하는 데에도 정책 초점이 맞춰졌다. 연구개발 이후 실증 단계에서 멈추거나 실증 이후 운영·확산 단계로 이어지지 못했던 구조를 개선하겠다는 것이다. 미션 지향형 R&D를 강화하고 연구 성과가 실제 문제 해결과 산업 수요로 이어질 수 있도록 범부처 협업을 전제로 한 과제 설계를 확대하겠다는 입장이다. AI 확산을 위한 실행 수단도 구체화됐다. 정부는 자율주행, 스마트공장, 의료·돌봄 등 분야별 AI 전환(AX)을 가속화하기 위해 기획·수행·확산 전 단계를 지원하는 ‘AX 전주기 원스톱 지원’ 체계를 추진한다. AI 과제 기획 단계부터 GPU, 데이터, 인재, 규제 대응까지 패키지로 지원해 실증 이후 단계로의 이행을 뒷받침하겠다는 구상이다. 공공 부문에서 축적된 AI 성과를 민간과 지역으로 확산시키는 구조도 함께 검토되고 있다. 대전 역시 다수의 정부출연연과 AI 기업이 밀집한 지역 특성상 연구 성과를 실증과 사업화로 연결하려는 시도가 이어진다. 지역 과기계 관계자는 ""이번 중장기 투자전략 논의에서 가장 강조된 부분은 성과를 얼마나 빠르게 현장으로 가져갈 수 있느냐였다""며 ""AI는 기술 개발만으로 성과를 판단하기 어려운 만큼 연구 단계부터 실증과 확산까지 염두에 둔 과제 설계와 정책 지원이 중요해지고 있다""고 설명했다. 조정민 기자",https://www.cctoday.co.kr/news/articleView.html?idxno=2225030,https://cdn.cctoday.co.kr/news/thumbnail/202602/2225030_677944_3732_v150.jpg
