date,press,region,title,sub_title,description,content,article_url,image_url
2026-01-27,한국경제,national,"""韓, 가장 저평가된 AI 수혜국"" 세계 최대 채권운용사 전망",,"세계 최대 채권운용사 핌코가 올해 아시아·태평양 경제를 전망하며 한국을 ""가장 저평가된 인공지능(AI) 수혜국""이라고 분석했다.핌코는 27일 아·태 경제 전망보고서에서 한국을 대만, 싱가포르와 더불어 '소규모 개방 경제'로 분류했...","세계 최대 채권운용사 핌코가 올해 아시아·태평양 경제를 전망하며 한국을 ""가장 저평가된 인공지능(AI) 수혜국""이라고 분석했다. 핌코는 27일 아·태 경제 전망보고서에서 한국을 대만, 싱가포르와 더불어 '소규모 개방 경제'로 분류했지만 ""가장 저평가된 AI 수혜국""으로 조명했다. 핌코는 한국이 글로벌 무역 패턴의 변화 속에서도 AI 관련 고부가가치 전자제품 수출로 견조한 성장세를 유지할 것으로 내다봤다. 한국, 대만, 싱가포르는 글로벌 관세 전쟁에서도 기술적 우위를 바탕으로 ""비교적 (안전하게) 관세 충격을 방어할 수 있다""고 평가했다. 트럼프의 관세 공격에도 한국 기업들의 실질적인 기초체력(펀더멘털)은 크게 훼손되지 않을 것이라는 얘기다. 반도체 사이클과의 연관성이 낮은 경제권은 경상수지 압박에 직면할 수 있는 반면 한국처럼 보다 개방된 경제권은 기술 관련 상품에 대한 탄탄한 수요로부터 지속 혜택을 입을 것이라고 내다봤다. 이어 한국과 같은 대부분 소규모 개방 경제국들이 금리인하 사이클의 끝에 가까워지고 있다고도 진단했다. 핌코는 별도의 연간 투자 가이드를 통해 ""한국은 틈새에서 강력한 상대 가치 기회를 제공한다""고 분석했다. 이어 ""한국과 대만에서 기회가 있다고 본다""며 ""기술주 분야에서 투자기회가 있을 것""이라고 설명했다. 엔비디아와 같은 미국 빅테크 주가가 이미 너무 높아 한국과 대만 반도체와 같은 주식은 AI 수혜를 입으면서도 훨씬 싸기 때문에 상대 가치 관점에서 우위에 있단 말이다. 이송렬 한경닷컴 기자",https://www.hankyung.com/article/2026012755057,https://img.hankyung.com/photo/202601/99.33577326.3.jpg
2026-01-27,한국경제,national,"""면접에서 왜 떨어졌죠?""…채용박람회에서 알려준다",,청년 취업난이 심화하는 가운데 올해 공공기관이 2만8000명을 정규직으로 채용한다. 정부는 채용박람회를 열고 취업 가능성이 높은 공공기관 추천과 면접 탈락 원인 분석 등 맞춤형 취업 지원 서비스도 제공할 계획이다.재정경제부는 27일 오는 29일까지 사흘간 서...,"청년 취업난이 심화하는 가운데 올해 공공기관이 2만8000명을 정규직으로 채용한다. 정부는 채용박람회를 열고 취업 가능성이 높은 공공기관 추천과 면접 탈락 원인 분석 등 맞춤형 취업 지원 서비스도 제공할 계획이다. 재정경제부는 27일 오는 29일까지 사흘간 서울 양재동 aT센터에서 ‘2026년 공공기관 채용정보박람회’를 개최한다고 밝혔다. 이번 박람회에는 148개 공공기관이 참여해 공공기관 취업을 희망하는 구직자들에게 기관별 채용 정보를 제공한다. 올해 공공기관의 정규직 채용 계획은 총 2020년 이후 최대규모인 2만8000명으로, 전년 목표치(2만4000명)보다 4000명 이상 늘었다. 정규직 채용의 징검다리 역할을 하는 청년인턴도 지난해보다 3000명 증가한 2만4000명을 선발할 예정이다. 올해 채용 규모가 1000명을 넘는 기관은 한국철도공사(1800명)를 비롯해 국민건강보험공단(1226명), 근로복지공단(1160명), 서울대병원(1078명), 한국전력공사(1042명) 등 여섯 곳이다. 이번 박람회에서는 구직자 맞춤형 취업 지원 프로그램도 새롭게 선보인다. 재경부는 희망 연봉과 근무 지역, 자기소개서 등 구직 정보를 입력하면 인공지능(AI)이 공공기관의 인재상과 채용 요건을 분석해 적합한 기관을 추천하는 ‘AI 현장 매칭’ 서비스를 도입했다. 면접 사례를 사전에 제출하면 탈락 원인과 개선 방향을 제시하는 ‘면접 리빌드 프로그램’도 운영한다. 이와 함께 공공기관 입사 준비를 위한 공개 모의면접 시연을 비롯해 국가직무능력표준(NCS) 필기시험과 AI 면접 체험 기회도 제공할 예정이다. 이광식 기자",https://www.hankyung.com/article/202601263081i,https://img.hankyung.com/photo/202601/01.36326891.3.jpg
2026-01-27,한국경제,national,"靑, 트럼프 25% 관세 긴급 대응…당정 ""법안 2월 처리""",,"도널드 트럼프 미국 대통령이 한국의 상호관세 및 자동차 등 품목 관세를 다시 25%로 인상하겠다고 한 것과 관련해 청와대가 대응에 나섰다.강유정 청와대 대변인은 27일 서면 브리핑을 통해 ""청와대는 이날 오전, 김용범 정책실장, 위성락 안보실장 주재로 대미 통상현안 회...","도널드 트럼프 미국 대통령이 한국의 상호관세 및 자동차 등 품목 관세를 다시 25%로 인상하겠다고 한 것과 관련해 청와대가 대응에 나섰다. 강유정 청와대 대변인은 27일 서면 브리핑을 통해 ""청와대는 이날 오전, 김용범 정책실장, 위성락 안보실장 주재로 대미 통상현안 회의를 개최해 트럼프 대통령의 관세인상 발표 관련 상황을 점검하고 대응계획을 논의했다""고 했다. 강 대변인은 ""회의에는 여한구 통상교섭본부장, 이형일 재정경제부 1차관, 김진아 외교부 2차관 등 관계 부처 차관이 참석했으며, 청와대 하준경 경제성장수석, 오현주 국가안보실 3차장, 하정우 AI미래기획수석 등 주요 참모들도 자리를 함께했다""며 ""현재 전략경제협력 특사단으로 캐나다에 체류 중인 강훈식 비서실장과 김정관 산업통상부 장관도 유선으로 참석했다""고 했다. 회의에서 참석자들은 관세협상 후속 조치로 추진 중인 '한미 전략적 투자 관리를 위한 특별법안' 진행 상황을 점검했다. 김정관 장관은 캐나다 일정이 종료되는 대로 미국을 방문해 러트닉 상무장관과 관련 내용을 논의하기로 했다. 여한구 통상교섭본부장도 조만간 미국을 방문해 그리어 USTR 대표와 협의하기로 했다. 강 대변인은 ""관세인상은 연방 관보게재 등 행정조치가 있어야 발효되는 만큼 우리 정부는 관세합의 이행 의지를 미국 측에 전달하는 한편 차분하게 대응해 나갈 계획""이라고 했다. 더불어민주당과 정부도 대응에 나섰다. 당정은 ""한국 정부나 국회가 이 법을 의도적으로 지체한다는 지적은 우리 국회 상황을 잘 알지 못한 데서 온 것 아닌가 한다""며 대미투자특별법을 2월 처리하겠다고 했다. 국회 재정경제기획위원회 여당 간사인 정태호 민주당 의원은 ""지난해 11월 말 법안을 발의했고 12월 의원 개인 발의로 4건이 올라왔다""며 ""12월은 정례적으로 새해 예산안 관련 세법 개정안을 집중적으로 심의하는 달이고, 1월은 인사청문회 때문에 심의 여건이 아니었다""고 했다. 이어 ""정상적으로 보면 2월 (법안) 심의 절차에 들어가게 된다""며 당초 설 민생 안정 대책 논의를 위해 마련된 이날 회의 자료에도 대미투자특별법을 2월까지 통과시켜 달라는 정부 요청이 있다고 부연했다. 그러면서 ""국민의힘도 비준이냐 법률이냐 소모적 논쟁을 하기보다 적극 입법 과정에 협조해달라""고 요청했다. 한편 트럼프 대통령은 26일(현지시간) 한국 의회가 한미 무역 합의를 이행하지 않고 있다며 관세 인상을 통보했다. 트럼프 대통령은 자신의 소셜미디어 트루스 소셜을 통해 ""이재명 대통령과 나는 지난해 7월 30일 양국에 이익이 되는 훌륭한 무역 협정을 체결했고 제가 지난해 10월 29일 한국을 방문했을 때 이 협정 내용을 재확인했다""며 ""그런데 왜 한국 국회는 이 협정을 승인하지 않은 것이냐""고 했다. 이어 ""나는 한국 국회가 우리의 역사적인 무역 협정을 입법화하지 않았기 때문에 자동차와 목재, 의약품, 기타 모든 상호관세를 15%에서 25%로 인상한다""고 밝혔다. 한미 무역 합의의 후속 조치로 발의된 '한·미 전략적 투자 관리를 위한 특별법'은 국회 재정경제기획위원회에 계류 중이다. 이송렬 한경닷컴 기자",https://www.hankyung.com/article/2026012751847,https://img.hankyung.com/photo/202601/ZA.43091236.3.jpg
2026-01-26,한국경제,national,"한국환경산업기술원, 발달장애 예술가 전시회…사회참여·경제활동 지원",,"한국환경산업기술원이 상생경영을 통해 지역사회에 따뜻한 온기를 전하고 있다. 장애인 일자리 지원과 지역사회와의 동반성장, 임직원 참여형 봉사활동 등을 통해 공공기관으로서의 사회적 책임을 적극 실천하고 있다.지난해 말부터 서울 은평구 한국환경산업기술원 본원 로비에서는 &l...","한국환경산업기술원이 상생경영을 통해 지역사회에 따뜻한 온기를 전하고 있다. 장애인 일자리 지원과 지역사회와의 동반성장, 임직원 참여형 봉사활동 등을 통해 공공기관으로서의 사회적 책임을 적극 실천하고 있다. 지난해 말부터 서울 은평구 한국환경산업기술원 본원 로비에서는 ‘발달장애 예술가와 함께하는 예술로 잇는 상생’ 전시회가 열리고 있다. ‘흰사슴 가족의 숲속 나들이’, ‘그림들의 마음’ 등 총 5점의 작품이 선보여 직원들과 지역 주민들의 관심을 모았다. 작가들은 모두 인근 지역에 거주하는 발달장애인 화가들이다. 이번 행사는 기술원이 발달장애인의 사회참여 확대와 경제적 자립을 지원하기 위해 스프링샤인 사회적협동조합과 협업해 마련했다. 전시 작품에는 QR코드를 부착해 관람객이 직접 작품을 구매할 수 있도록 하고 있다. 김종수 스프링샤인 사회적협동조합 대표는 “환경을 지키는 일과 사람의 가능성을 키우는 일이 같은 방향이라는 점을 느꼈다”며 “뜻깊은 공간을 마련해준 데 감사하다”고 말했다. 기술원은 장애인 직업재활 사회적기업인 굿윌스토어와도 꾸준히 협력하고 있다. 2019년 업무협약 체결 이후 임직원 기증 캠페인을 이어오고 있다. 기증된 물품은 굿윌스토어 장애인 직원들의 손길을 거쳐 판매되며 수익금은 장애인 일자리 창출에 쓰인다. 지금까지 7년간 13차례의 캠페인을 통해 약 3만150여 점의 물품이 기증됐다. 이 밖에도 헌혈 참여를 비롯해 지역 노인복지시설 봉사, 초등학생 대상 환경교육, 치매 예방 노인 교구재 제작, 어린이 활동공간 벽화 채색, 취약계층 제빵 봉사 등 임직원 참여형 사회공헌 활동을 지속적으로 펼치고 있다. 공공기관으로서 재난·재해 대응에도 앞장서고 있다. 지난해 여름 은평구 일대에 집중호우로 침수 피해가 발생하자 임직원들이 직접 현장을 찾아 피해 복구 봉사활동을 했다. 사회복지공동모금회를 통해 성금 1500만원을 기탁하기도 했다. 지난 4월에는 산불 피해 복구를 위해 임직원 성금 2000만원을 희망브리지 전국재해구호협회에 전달했다. 지역경제 활성화를 위한 노력도 빼놓을 수 없다. 기술원은 지역 내 사회적경제기업의 판로 개척을 지원하기 위해 매년 사회적기업 주간을 운영하고 공공구매 상담회를 열고 있다. 기술원은 이 같은 노력을 인정받아 중소벤처기업부 주관 ‘2024년도 공공기관 동반성장 평가’에서 2년 연속 최우수 등급을 달성했다. 또 보건복지부 주관 ‘지역사회공헌 인정제’에서 3년 연속 최고 등급을 획득했으며, 대·중소기업·농어업협력재단 등이 주관하는 ‘농어촌 ESG 실천 인정기업’에도 4년 연속 선정됐다. 김영기 한국환경산업기술원 원장 직무대행은 “공공기관으로서 사회적 책임과 역할을 충실히 이행하고 사회취약계층 지원과 지역경제 활성화, 동반성장 강화를 통해 국민이 체감할 수 있는 상생 가치를 현장에서 지속적으로 실천해 나가겠다”고 말했다. 하지은 기자",https://www.hankyung.com/article/2026012621571,https://img.hankyung.com/photo/202601/AA.43078842.3.jpg
2026-02-09,한국경제,national,"예상 깬 환율…日, 외환시장 개입 경고에 엔화 강세",,일본 자민당의 총선 압승 직후 첫 거래일인 9일 원·달러 환율과 엔·달러 환율이 동반 하락(통화 가치는 상승)했다. 일본 정부가 외환시장에 구두 개입한 데다 양국 증시가 급등한 영향으로 분석됐다.9일 서울외환시장에서 원·달러 환율(...,"일본 자민당의 총선 압승 직후 첫 거래일인 9일 원·달러 환율과 엔·달러 환율이 동반 하락(통화 가치는 상승)했다. 일본 정부가 외환시장에 구두 개입한 데다 양국 증시가 급등한 영향으로 분석됐다. 9일 서울외환시장에서 원·달러 환율(오후 3시30분 기준)은 전 거래일보다 9원20전 내린 1460원30전에 낮 시간대 거래를 마쳤다. 이날 환율은 4원 내린 1465원50전에 출발해 오전에 1459원까지 내렸다가 오후 들어 낙폭을 일부 반납했다. 이날 환율이 내린 것은 글로벌 위험회피 심리가 완화된 영향으로 풀이됐다. 민경원 우리은행 연구원은 “뉴욕증시에서 인공지능 과잉 투자 우려가 진화된 것이 위험 통화인 원화 강세 재료로 소화됐다”고 설명했다. 이날 외국인 투자자는 유가증권시장에서 총 4491억원어치를 순매수했다. 엔·달러 환율도 하락했다. 이날 엔·달러 환율은 156.41엔에 거래됐다. 전 거래일 157.27엔에서 약 0.5% 내렸다. 당초 시장에선 일본 자민당이 총선에서 압승하면 재정건전성 우려가 확산해 엔화 가치가 떨어질 것으로 예상했지만, 실제 결과는 달랐다. 일본 외환당국이 연이틀 외환시장에 경고한 게 영향을 미쳤다고 전문가들은 판단했다. 전날 가타야마 사쓰키 일본 재무상이 “외환시장에 단호한 조치를 할 수 있다”고 발언한 데 이어 이날은 미무라 아쓰시 재무성 재무관이 외환시장 동향과 관련해 “높은 긴장감을 갖고 주시하고 있다”고 경고했다. 지난주 재정건전성 우려가 선반영되면서 양국 환율이 오른 만큼 일부 되돌려지는 장세가 나타났다는 시각도 있다. 한국뿐 아니라 일본 증시에서도 닛케이지수가 장중 사상 최고치를 경신하는 등 투자심리가 살아났다. 강진규 기자",https://www.hankyung.com/article/2026020945351,https://img.hankyung.com/photo/202602/AA.43235880.3.jpg
2026-02-06,한국경제,national,달러 번 만큼 그대로 나갔다,,지난해 역대 최대 규모의 경상수지 흑자에도 환율이 고공 행진한 것에 대해 한국은행이 “경상수지 흑자액에 육박하는 해외주식 투자액 때문”이라고 분석했다. 특히 개인의 해외주식 투자가 가장 많은 것으로 나타났다.한은은 6일 2025년 국제수지를 발표하면서 지난해 해외주식 투자액이 역대 최대라는 점도 함께 언급했다. 한은에 따르면 지난해 내...,"지난해 역대 최대 규모의 경상수지 흑자에도 환율이 고공 행진한 것에 대해 한국은행이 “경상수지 흑자액에 육박하는 해외주식 투자액 때문”이라고 분석했다. 특히 개인의 해외주식 투자가 가장 많은 것으로 나타났다. 한은은 6일 2025년 국제수지를 발표하면서 지난해 해외주식 투자액이 역대 최대라는 점도 함께 언급했다. 한은에 따르면 지난해 내국인의 해외주식 투자액은 1143억4790만달러로 집계됐다. 2024년 421억5660만달러에 비해 약 세 배로 증가했다. 이는 경상수지 흑자(1230억5380만달러)의 92.9%에 해당하는 수준이다. 경상수지 흑자로 벌어들인 달러가 대부분 해외투자로 다시 나갔다는 의미다. 일반적으로 경상수지 흑자로 달러가 유입되면 환율이 하락하는 게 보통이지만 작년엔 해외투자 급증으로 이런 공식이 작동하지 않았다. 지난해 연평균 환율은 달러당 1421원97전으로 역대 최고 수준이었다. 경제주체별로 보면 개인투자자의 해외주식 투자액이 가장 많았다. 통계상 개인투자자의 해외주식 투자액은 314억달러로 집계됐으나, 자산운용사를 통해 해외 주식 상장지수펀드(ETF)를 산 금액을 포함하면 직간접적인 투자액이 450억달러에 이르는 것으로 추정됐다. 이는 국민연금 등 공적 기관의 투자액(407억달러)보다 많은 것으로, 2024년 모든 경제주체의 해외주식 투자 합산액(421억달러)을 웃도는 수준이다. 김영환 한은 경제통계1국장은 “해외투자 증가가 외환시장 수급 측면에서 펀더멘털 요인인 경상수지 흑자 효과를 상당 부분 상쇄한 것으로 분석된다”고 말했다. 환율은 이날도 높은 수준을 이어갔다. 서울외환시장에서 원·달러 환율은 전거래일보다 50전 오른 1469원50전에 주간 거래를 마쳤다. 유가증권시장에서 외국인 투자자가 3조3270억원어치 순매도를 기록하는 등 상승 압력이 나타났지만 오후 들어 다소 진정되면서 상승폭을 축소했다. 재정경제부가 지난 5일 30억달러 규모의 달러 표시 외국환평형기금채권을 발행했다는 소식이 이날 알려진 것도 환율 상승폭 축소에 영향을 줬다. 강진규",https://www.hankyung.com/article/2026020697551,
2026-02-05,한국경제,national,외국인 5조원 '역대급 투매'…원·달러 환율 18원 뛰었다,,원·달러 환율이 장중 1470원 수준까지 급등(원화 가치는 급락)했다. 글로벌 엔화 약세와 달러 강세가 동시에 나타나는 상황에서 외국인 투자자가 유가증권시장에서 5조원 가까이 국내 주식을 순매도했기 때문으로 분석된다.5일 서울 외환시장에서 원·달러 환율(오후 3시30분 기준)은 전날보다 18원80전 상승한 1469원에 낮 시간대 거...,원·달러 환율이 장중 1470원 수준까지 급등(원화 가치는 급락)했다. 글로벌 엔화 약세와 달러 강세가 동시에 나타나는 상황에서 외국인 투자자가 유가증권시장에서 5조원 가까이 국내 주식을 순매도했기 때문으로 분석된다. 5일 서울 외환시장에서 원·달러 환율(오후 3시30분 기준)은 전날보다 18원80전 상승한 1469원에 낮 시간대 거래를 마쳤다. 이날 환율은 10원80전 오른 1461원으로 출발한 뒤 상승 폭을 키웠다. 1470원을 돌파하지는 않았지만 종가 기준으로 지난달 22일(1469원90전) 이후 2주 만에 가장 높은 수준까지 올랐다. 이날 환율이 오른 것은 외국인 투자자가 국내 주식을 내던진 영향이 큰 것으로 파악된다. 이날 유가증권시장에서 외국인은 5조216억원어치에 달하는 주식을 순매도했다. 외국인이 원화 자산을 팔고 달러로 환전하려는 수요가 몰리면 원화는 큰 약세 압력을 받는다. 글로벌 외환시장 환경도 원화에 우호적이지 않았다. 미국에선 달러 강세가 나타났다. 간밤 스콧 베선트 미국 재무장관이 연방 하원 청문회에서 “강달러 정책을 항상 지지한다”고 밝힌 영향이다. 주요 6개국 통화 대비 달러 가치를 나타내는 달러인덱스가 전날보다 0.14% 오른 97.799까지 뛰었다. 지난달 27일 95선까지 내린 달러인덱스의 상승세가 뚜렷했다. 원화와 동조화 경향이 강해지고 있는 엔화는 약세 폭이 커졌다. 일본 조기 총선에서 자민당의 압승 가능성이 커지자 다카이치 사나에 총리가 더욱 적극적인 재정 확장 정책을 펼칠 것이란 전망이 강해졌기 때문이란 분석이 나온다. 다카이치 총리가 최근 유세에서 “엔저(低)가 나쁘다고 말하지만 수출산업에는 큰 기회”라고 언급하는 등 환율 상승을 용인하는 듯한 메시지를 낸 것도 엔화 약세를 더욱 부추겼다. 이날 엔·달러 환율은 한때 전날보다 0.1282엔 오른 157.048엔까지 뛰었다. 강진규 기자,https://www.hankyung.com/article/2026020572151,
2026-02-05,한국경제,national,엔화 약세·강달러·외국인 5조 투매…'3중고'에 환율 18원 급등,,원·달러 환율이 급등(원화 가치는 급락)해 1470원에 육박하는 수준까지 올랐다. 글로벌 엔화 약세와 달러 강세가 나타나고 있는 상황에서 외국인 투자자들이 유가증권시장에서 5조원 가까이 순매도하면서 원화 약세를 부추겼다.5일 서울 외환시장...,"원·달러 환율이 급등(원화 가치는 급락)해 1470원에 육박하는 수준까지 올랐다. 글로벌 엔화 약세와 달러 강세가 나타나고 있는 상황에서 외국인 투자자들이 유가증권시장에서 5조원 가까이 순매도하면서 원화 약세를 부추겼다. 5일 서울 외환시장에서 원·달러 환율(오후 3시30분 기준)은 전날보다 18원80전 상승한 1469원에 낮 시간대 거래를 마쳤다. 이날 환율은 10원80전 오른 1461원으로 출발한 뒤 장중 상승 폭을 키웠다. 1470원을 돌파하지는 않았지만 종가 기준으로 지난 22일(1469원90전) 이후 2주만에 가장 높은 수준까지 올랐다. 이날 환율이 오른 것은 외국인 투자자들이 국내 주식을 대규모로 매도한 영향으로 파악됐다. 이날 유가증권시장에서 외국인은 5조216억원어치에 달하는 주식을 순매도했다. 외국인들이 원화 자산을 팔고 달러로 환전하려는 수요가 몰리면 원화는 큰 약세 압력을 받는다. 글로벌 통화가치 환경도 원화에 우호적이지 않았다. 미국에선 달러 강세가 나타났다. 간밤 스콧 베선트 미국 재무장관은 연방 하원 청문회에서 ""강달러 정책을 항상 지지한다""고 밝혔다. 이에 주요 6개국 통화 대비 달러 가치를 나타내는 달러인덱스는 전날보다 0.14% 오른 97.799 수준까지 올랐다. 지난달 27일 95선까지 내렸다가 상승세가 뚜렷하다. 원화와 동조화 경향이 강해지고 있는 엔화는 약세 폭이 커졌다. 일본의 조기총선이 사흘 앞으로 다가온 가운데 자민당의 압승 가능성이 유력해지면서 확장재정으로 인한 엔화 약세가 나타날 것이란 기대가 커지고 있다. 다카이치 사나에 일본 총리가 최근 유세에서 ""엔저니까 나쁘다고 말하지만 수출 산업에는 큰 기회""라고 언급하는 등 엔저를 용인하는 메시지를 낸 것도 엔화 약세를 더욱 부추겼다. 엔·달러 환율은 전날보다 0.002엔 오른 156.922엔이다. 장중에는 157.048엔까지 뛰었다. 강진규 기자",https://www.hankyung.com/article/202602056621i,https://img.hankyung.com/photo/202602/ZN.43129363.3.jpg
2026-02-05,한국경제,national,"한국·인도네시아, 원화-루피아화 통화스와프 5년간 연장",,한국은행과 인도네시아 중앙은행이 10조7000억원 규모의 원화와 루피아화 간 통화 스와프를 5년 간 연장하기로 결정했다. 한은은 5일 이창용 한은 총재와 페리 와르지요 인도네시아 중앙은행 총재가 이같은 내용을 담은 통화스와프 연장 계약을 체결했다고 밝혔다. 계...,"한국은행과 인도네시아 중앙은행이 10조7000억원 규모의 원화와 루피아화 간 통화 스와프를 5년 간 연장하기로 결정했다. 한은은 5일 이창용 한은 총재와 페리 와르지요 인도네시아 중앙은행 총재가 이같은 내용을 담은 통화스와프 연장 계약을 체결했다고 밝혔다. 계약기간은 2031년 3월5일까지로 스와프 규모는 10조7000억원과 115조루피아다. 인도네시아와의 통화스와프는 지난 2014년 처음으로 체결된 이후 3년 단위로 연장되다가 이번에 계약 기간을 5년으로 더 늘렸다. 한은은 ""양국간 통화스와프 계약은 상호 교역을 촉진하고 금융협력을 강화하기 위한 목적으로 체결했다""며 ""국제금융시장의 변동성이 높은 시기에도 스왑자금을 활용해 수출입대금을 안정적으로 결제함으로써 역내 교역촉진 및 금융안정에 기여할 것으로 기대한다""고 밝혔다. 한은은 이날 인도네시아 중앙은행과 국가간 QR기반 지급서비스 연계를 위한 협력도 지속하겠다고 밝혔다. 강진규 기자",https://www.hankyung.com/article/202602056009i,https://img.hankyung.com/photo/202602/AA.37160749.3.jpg
